tweet_id,in_reply_to_status_id,in_reply_to_user_id,timestamp,source,text,expanded_urls,rating_numerator,name,dog_stage,dog_breed,retweet_count,favorite_count
682393905736888321,,,2015-12-31 02:52:40 +0000,http://twitter.com/download/iphone,This is Kreg. He's riding an invisible jet ski. 11/10 that's downright legendary https://t.co/BA5AV5dx6Y,https://twitter.com/dog_rates/status/682393905736888321/photo/1,11.0,Kreg,None,vizsla,726,2327
682389078323662849,,,2015-12-31 02:33:29 +0000,http://twitter.com/download/iphone,"Meet Brody. He's a Downton Abbey Falsetto. Addicted to grating cheese. He says he can stop but we know he can't
9/10 https://t.co/vBeiQq6SaZ",https://twitter.com/dog_rates/status/682389078323662849/photo/1,9.0,Brody,None,curly-coated_retriever,495,1730
682259524040966145,,,2015-12-30 17:58:40 +0000,http://twitter.com/download/iphone,Meet Jax. He's an Iglesias Hufflepoof. Quite the jokester. Takes it too far sometimes. Can be very hurtful. 9/10 https://t.co/i5TeG0KYcW,https://twitter.com/dog_rates/status/682259524040966145/photo/1,9.0,Jax,None,Siberian_husky,1284,4333
682032003584274432,,,2015-12-30 02:54:35 +0000,http://twitter.com/download/iphone,This is Ulysses. He likes holding hands and his eyes are magic. 11/10 https://t.co/gPmJHmtgak,https://twitter.com/dog_rates/status/682032003584274432/photo/1,11.0,Ulysses,None,schipperke,2131,6837
681981167097122816,,,2015-12-29 23:32:35 +0000,http://twitter.com/download/iphone,This is Jimothy. He's a Trinidad Poliwhirl. Father was a velociraptor. Exceptionally unamused. 12/10 would adopt https://t.co/VwdIk0OwVx,https://twitter.com/dog_rates/status/681981167097122816/photo/1,12.0,Jimothy,None,Labrador_retriever,1092,2904
681891461017812993,,,2015-12-29 17:36:07 +0000,http://twitter.com/download/iphone,Say hello to Charlie. He's scholarly af. Quite intimidating with all his pupper knowledge 10/10 even built that fire https://t.co/9KThv6z8u5,https://twitter.com/dog_rates/status/681891461017812993/photo/1,10.0,Charlie,pupper,Chihuahua,870,2560
681694085539872773,,,2015-12-29 04:31:49 +0000,http://twitter.com/download/iphone,This is Bo. He's a Benedoop Cumbersnatch. Seems frustrated with own feet. Portable as hell. 11/10 very solid pupper https://t.co/TONMhRoQh7,https://twitter.com/dog_rates/status/681694085539872773/photo/1,11.0,Bo,pupper,toy_poodle,4296,13275
681654059175129088,,,2015-12-29 01:52:46 +0000,http://twitter.com/download/iphone,This is Toffee. He's a happy pupper. Appears dangerously fluffy. Extraordinarily spherical. 12/10 would pet firmly https://t.co/oEXEKt3MHu,https://twitter.com/dog_rates/status/681654059175129088/photo/1,12.0,Toffee,pupper,Pomeranian,983,2735
681610798867845120,,,2015-12-28 23:00:52 +0000,http://twitter.com/download/iphone,*collapses* 12/10 https://t.co/C7M8mnzHIK,https://twitter.com/dog_rates/status/681610798867845120/photo/1,12.0,None,None,toy_poodle,503,1988
681579835668455424,,,2015-12-28 20:57:50 +0000,http://twitter.com/download/iphone,This is Apollo. He thought you weren't coming back so he had a mental breakdown. 8/10 we've all been there https://t.co/ojUBrDCHLT,https://twitter.com/dog_rates/status/681579835668455424/photo/1,8.0,Apollo,None,Rottweiler,1376,3689
681320187870711809,,,2015-12-28 03:46:05 +0000,http://twitter.com/download/iphone,This is Glacier. He's a very happy pup. Loves to sing in the sunlight. 11/10 https://t.co/jTBPqKgkz7,https://twitter.com/dog_rates/status/681320187870711809/photo/1,11.0,Glacier,None,Samoyed,796,2756
681297372102656000,,,2015-12-28 02:15:26 +0000,http://twitter.com/download/iphone,"This is actually a lion. We only rate dogs. For the last time please only send dogs. Thank u.
12/10 would still pet https://t.co/Pp26dMQxap",https://twitter.com/dog_rates/status/681297372102656000/photo/1,12.0,actually,None,Lhasa,1017,3332
681281657291280384,,,2015-12-28 01:12:59 +0000,http://twitter.com/download/iphone,Meet Sarge. His parents signed him up for dancing lessons but his true passion is roller coasters 11/10 very petable https://t.co/KvVoBIgkje,https://twitter.com/dog_rates/status/681281657291280384/photo/1,11.0,Sarge,None,Saint_Bernard,1168,3342
681261549936340994,,,2015-12-27 23:53:05 +0000,http://twitter.com/download/iphone,Say hello to Panda. He's a Quackadilly Shooster. Not amused by your fake ball throwing motion. 9/10 would hug lots https://t.co/wL1iDvbcVk,https://twitter.com/dog_rates/status/681261549936340994/photo/1,9.0,Panda,None,Tibetan_terrier,290,1516
681231109724700672,,,2015-12-27 21:52:07 +0000,http://twitter.com/download/iphone,I just love this pic. 11/10 this pupper is going places https://t.co/P16uhh1PbI,https://twitter.com/dog_rates/status/681231109724700672/photo/1,11.0,None,pupper,Irish_setter,513,2494
681193455364796417,,,2015-12-27 19:22:30 +0000,http://twitter.com/download/iphone,This is Aspen. He's astronomically fluffy. I wouldn't stop petting this dog if the world was ending around me 11/10 https://t.co/oBlgL9nxpx,"https://twitter.com/dog_rates/status/681193455364796417/photo/1,https://twitter.com/dog_rates/status/681193455364796417/photo/1",11.0,Aspen,None,Pomeranian,1568,3857
680970795137544192,,,2015-12-27 04:37:44 +0000,http://twitter.com/download/iphone,I thought I made this very clear. We only rate dogs. Stop sending other things like this shark. Thank you... 9/10 https://t.co/CXSJZ4Stk3,https://twitter.com/dog_rates/status/680970795137544192/photo/1,9.0,None,None,pug,708,2522
680940246314430465,,,2015-12-27 02:36:20 +0000,http://twitter.com/download/iphone,This is Alice. She's an idiot. 4/10 https://t.co/VQXdwJfkyS,https://twitter.com/dog_rates/status/680940246314430465/photo/1,4.0,Alice,None,soft-coated_wheaten_terrier,1120,3345
680934982542561280,,,2015-12-27 02:15:25 +0000,http://twitter.com/download/iphone,Say hello to Sadie. She's a Tortellini Sidewinder. Very jubilant pup. Seems loyal. Leaves on point. 10/10 petable af https://t.co/g2bTu4ayPl,https://twitter.com/dog_rates/status/680934982542561280/photo/1,10.0,Sadie,None,Labrador_retriever,466,2156
680913438424612864,,,2015-12-27 00:49:49 +0000,http://twitter.com/download/iphone,Meet Griswold. He's dapper as hell. Already pumped for next Christmas. 11/10 https://t.co/5NrpNDyFzN,https://twitter.com/dog_rates/status/680913438424612864/photo/1,11.0,Griswold,None,Pomeranian,655,2488
680889648562991104,,,2015-12-26 23:15:17 +0000,http://twitter.com/download/iphone,This is Cheesy. It's her birthday. She's patiently waiting to eat her party muffin. 9/10 happy birthday pup https://t.co/cH2H7mch2H,https://twitter.com/dog_rates/status/680889648562991104/photo/1,9.0,Cheesy,None,Shetland_sheepdog,385,1833
680836378243002368,,,2015-12-26 19:43:36 +0000,http://twitter.com/download/iphone,This is Ellie. She's secretly ferocious. 12/10 very deadly pupper https://t.co/BF4BW8LUgb,"https://twitter.com/dog_rates/status/680836378243002368/photo/1,https://twitter.com/dog_rates/status/680836378243002368/photo/1,https://twitter.com/dog_rates/status/680836378243002368/photo/1",12.0,Ellie,pupper,Pembroke,1406,3590
680801747103793152,,,2015-12-26 17:25:59 +0000,http://twitter.com/download/iphone,Great picture here. Dog on the right panicked &amp; forgot about his tongue. Middle green dog must've fainted. All 10/10 https://t.co/31npKUAox0,https://twitter.com/dog_rates/status/680801747103793152/photo/1,10.0,None,None,pug,872,2459
680609293079592961,,,2015-12-26 04:41:15 +0000,http://twitter.com/download/iphone,This is Brody. That is his chair. He loves his chair. Never leaves it. 9/10 might be stuck actually https://t.co/WvJRg0XJit,https://twitter.com/dog_rates/status/680609293079592961/photo/1,9.0,Brody,None,French_bulldog,753,2737
680497766108381184,,,2015-12-25 21:18:05 +0000,http://twitter.com/download/iphone,Meet Percy. He's a Latvian Yuletide Heineken. Refuses to take off sweater. Kinda feisty. 12/10 would keep in pocket https://t.co/QGM5Fcuv7s,https://twitter.com/dog_rates/status/680497766108381184/photo/1,12.0,Percy,None,Chihuahua,2013,4392
680494726643068929,,,2015-12-25 21:06:00 +0000,http://twitter.com/download/iphone,Here we have uncovered an entire battalion of holiday puppers. Average of 11.26/10 https://t.co/eNm2S6p9BD,https://twitter.com/dog_rates/status/680494726643068929/photo/1,26.0,None,None,kuvasz,510,1782
680473011644985345,,,2015-12-25 19:39:43 +0000,http://twitter.com/download/iphone,"This is Hector. He thinks he's a hammer. Silly Hector. You're a pupper, not a hammer. 10/10 https://t.co/OdUFuZIXiI",https://twitter.com/dog_rates/status/680473011644985345/photo/1,10.0,Hector,pupper,Lakeland_terrier,789,2647
680191257256136705,,,2015-12-25 01:00:07 +0000,http://twitter.com/download/iphone,Here's a sleepy Christmas pupper 11/10 https://t.co/KXg0f8GNQ9,https://twitter.com/dog_rates/status/680191257256136705/photo/1,11.0,None,pupper,Brittany_spaniel,532,2226
680161097740095489,,,2015-12-24 23:00:17 +0000,http://twitter.com/download/iphone,Meet Goliath. He's an example of irony. Head is phenomenally round. Wants to be an ornament. 12/10 would hug gently https://t.co/72Dil0Aktw,https://twitter.com/dog_rates/status/680161097740095489/photo/1,12.0,Goliath,None,bluetick,779,2408
680145970311643136,,,2015-12-24 22:00:10 +0000,http://twitter.com/download/iphone,Say hello to Kawhi. He was doing fine until his hat fell off. He got it back though. 10/10 deep breaths pupper https://t.co/N5pM6WBx7e,"https://twitter.com/dog_rates/status/680145970311643136/photo/1,https://twitter.com/dog_rates/status/680145970311643136/photo/1,https://twitter.com/dog_rates/status/680145970311643136/photo/1",10.0,Kawhi,pupper,miniature_poodle,1848,3753
680130881361686529,,,2015-12-24 21:00:12 +0000,http://twitter.com/download/iphone,This is Reggie. His Santa hat is a little big. 10/10 he's still having fun https://t.co/w0dcGXq7qK,https://twitter.com/dog_rates/status/680130881361686529/photo/1,10.0,Reggie,None,Maltese_dog,1002,2366
680115823365742593,,,2015-12-24 20:00:22 +0000,http://twitter.com/download/iphone,This is Ozzy. He woke up 2 minutes before he had to be ready for the Christmas party. 9/10 classic Ozzy https://t.co/Kt9vmw0Fap,https://twitter.com/dog_rates/status/680115823365742593/photo/1,9.0,Ozzy,None,pug,956,2806
680100725817409536,,,2015-12-24 19:00:23 +0000,https://about.twitter.com/products/tweetdeck,This pupper is not coming inside until she catches a snowflake on her tongue. 11/10 the determination is palpable https://t.co/lvMYbmKq8H,https://twitter.com/dog_rates/status/680100725817409536/photo/1,11.0,None,pupper,golden_retriever,1445,3702
679862121895714818,,,2015-12-24 03:12:15 +0000,http://twitter.com/download/iphone,"""Dammit hooman I'm jus trynna lik the fler"" 11/10 https://t.co/eRZRI8OTj7",https://twitter.com/dog_rates/status/679862121895714818/photo/1,11.0,None,None,EntleBucher,655,2550
679844490799091713,,,2015-12-24 02:02:12 +0000,http://twitter.com/download/iphone,This is Willie. He's floating away and needs your assistance. Please someone help Willie. 10/10 https://t.co/MJqygWqt8X,https://twitter.com/dog_rates/status/679844490799091713/photo/1,10.0,Willie,None,Airedale,806,2457
679777920601223168,,,2015-12-23 21:37:40 +0000,http://twitter.com/download/iphone,This is Rinna. She's melting. 10/10 get inside pupper https://t.co/PA0czwucsb,https://twitter.com/dog_rates/status/679777920601223168/photo/1,10.0,Rinna,pupper,bloodhound,1176,3197
679736210798047232,,,2015-12-23 18:51:56 +0000,http://twitter.com/download/iphone,This pup's name is Sabertooth (parents must be cool). Ears for days. Jumps unannounced. 9/10 would pet diligently https://t.co/iazoiNUviP,https://twitter.com/dog_rates/status/679736210798047232/photo/1,9.0,None,None,French_bulldog,838,2164
679722016581222400,,,2015-12-23 17:55:32 +0000,http://twitter.com/download/iphone,This is Mike. He is a Jordanian Frito Pilates. Frowning because he can't see directly in front of him. 8/10 https://t.co/NL5QJwdEpF,https://twitter.com/dog_rates/status/679722016581222400/photo/1,8.0,Mike,None,boxer,495,1718
679530280114372609,,,2015-12-23 05:13:38 +0000,http://twitter.com/download/iphone,Guys this really needs to stop. We've been over this way too many times. This is a giraffe. We only rate dogs.. 7/10 https://t.co/yavgkHYPOC,https://twitter.com/dog_rates/status/679530280114372609/photo/1,7.0,None,None,dalmatian,2196,4939
679511351870550016,,,2015-12-23 03:58:25 +0000,http://twitter.com/download/iphone,Say hello to William. He makes fun of others because he's terrified of his own deep-seated insecurities. 7/10 https://t.co/bwuV6FlRxr,https://twitter.com/dog_rates/status/679511351870550016/photo/1,7.0,William,None,Chihuahua,1342,3495
679475951516934144,,,2015-12-23 01:37:45 +0000,http://twitter.com/download/iphone,This is Evy. She doesn't want to be a Koala. 9/10 https://t.co/VITeF0Kl9L,https://twitter.com/dog_rates/status/679475951516934144/photo/1,9.0,Evy,None,Maltese_dog,673,2165
679148763231985668,,,2015-12-22 03:57:37 +0000,http://twitter.com/download/iphone,I know everyone's excited for Christmas but that doesn't mean you can send in reindeer. We only rate dogs... 8/10 https://t.co/eWjWgbOCYL,https://twitter.com/dog_rates/status/679148763231985668/photo/1,8.0,None,None,Italian_greyhound,1090,2871
679132435750195208,,,2015-12-22 02:52:45 +0000,http://twitter.com/download/iphone,This is Louis. He's a river dancer. His friends think it's badass. All are very supportive. 10/10 for Louis https://t.co/qoIvjKMY58,https://twitter.com/dog_rates/status/679132435750195208/photo/1,10.0,Louis,None,Scottish_deerhound,1224,3071
679111216690831360,,,2015-12-22 01:28:25 +0000,http://twitter.com/download/iphone,This is officially the greatest yawn of all time. 12/10 https://t.co/4R0Cc0sLVE,https://twitter.com/dog_rates/status/679111216690831360/video/1,12.0,officially,None,kelpie,2700,6165
678991772295516161,,,2015-12-21 17:33:48 +0000,http://twitter.com/download/iphone,If your Monday isn't going so well just take a look at this. Both 12/10 https://t.co/GJT6SILPGU,https://twitter.com/dog_rates/status/678991772295516161/photo/1,12.0,None,None,Eskimo_dog,1244,2405
678969228704284672,,,2015-12-21 16:04:13 +0000,http://twitter.com/download/iphone,Meet Lola. She's a Metamorphic Chartreuse. Plays with her food. Insubordinate and churlish. Exquisite hardwood 11/10 https://t.co/etpBNXwN7f,https://twitter.com/dog_rates/status/678969228704284672/photo/1,11.0,Lola,None,Labrador_retriever,487,1698
678800283649069056,,,2015-12-21 04:52:53 +0000,http://twitter.com/download/iphone,Here's a pupper with some mean tan lines. Snazzy sweater though 12/10 https://t.co/DpCSVsl6vu,https://twitter.com/dog_rates/status/678800283649069056/photo/1,12.0,None,pupper,Labrador_retriever,953,2666
678798276842360832,,,2015-12-21 04:44:55 +0000,http://twitter.com/download/iphone,This is Linda. She fucking hates trees. 7/10 https://t.co/blaY85FIxR,https://twitter.com/dog_rates/status/678798276842360832/photo/1,7.0,Linda,None,Airedale,1253,3592
678774928607469569,,,2015-12-21 03:12:08 +0000,http://twitter.com/download/iphone,This is Tug. He's not required to wear the cone he just wants his voice to project more clearly. 11/10 https://t.co/Sp739Ou2qx,https://twitter.com/dog_rates/status/678774928607469569/photo/1,11.0,Tug,None,Pembroke,968,2893
678764513869611008,,,2015-12-21 02:30:45 +0000,http://twitter.com/download/iphone,"Meet Wilson. He got caught humping the futon. He's like ""dude, help me out here"" 10/10 I'd help Wilson out https://t.co/m6XoclB0qv",https://twitter.com/dog_rates/status/678764513869611008/photo/1,10.0,Wilson,None,Irish_terrier,503,1695
678755239630127104,,,2015-12-21 01:53:54 +0000,http://twitter.com/download/iphone,This is Dash. He didn't think the water would be that cold. Damn it Dash it's December. Think a little. 10/10 https://t.co/NqcOwG8pxW,https://twitter.com/dog_rates/status/678755239630127104/photo/1,10.0,Dash,None,malamute,3490,7379
678643457146150913,,,2015-12-20 18:29:43 +0000,http://twitter.com/download/iphone,Meet Grizz. He just arrived. Couldn't wait until Christmas. Worried bc he saw the swastikas on the carpet. 10/10 https://t.co/QBGwYrT7rv,https://twitter.com/dog_rates/status/678643457146150913/photo/1,10.0,Grizz,None,Labrador_retriever,446,2118
678446151570427904,,,2015-12-20 05:25:42 +0000,http://twitter.com/download/iphone,Touching scene here. Really stirs up the emotions. The bond between father &amp; son. So beautiful. 10/10 for both pups https://t.co/AJWJHov5gx,https://twitter.com/dog_rates/status/678446151570427904/photo/1,10.0,None,None,Staffordshire_bullterrier,1651,4129
678424312106393600,,,2015-12-20 03:58:55 +0000,http://twitter.com/download/iphone,This is Crystal. She's a shitty fireman. No sense of urgency. People could be dying Crystal. 2/10 just irresponsible https://t.co/rtMtjSl9pz,https://twitter.com/dog_rates/status/678424312106393600/photo/1,2.0,Crystal,None,Maltese_dog,2676,5586
678410210315247616,,,2015-12-20 03:02:53 +0000,http://twitter.com/download/iphone,Say hello to Jerome. He can shoot french fries out of his mouth at insane speeds. Deadly af. 10/10 https://t.co/dIy88HwrX8,https://twitter.com/dog_rates/status/678410210315247616/photo/1,10.0,Jerome,None,schipperke,1922,4370
678396796259975168,,,2015-12-20 02:09:34 +0000,http://twitter.com/download/iphone,These little fellas have opposite facial expressions. Both 12/10 https://t.co/LmThv0GWen,"https://twitter.com/dog_rates/status/678396796259975168/photo/1,https://twitter.com/dog_rates/status/678396796259975168/photo/1",12.0,None,None,Pembroke,443,1642
678389028614488064,,,2015-12-20 01:38:42 +0000,http://twitter.com/download/iphone,"This is Bella. She just learned that her final grade in chem was a 92.49 
poor pupper 11/10 https://t.co/auOoKuoveM",https://twitter.com/dog_rates/status/678389028614488064/photo/1,11.0,Bella,pupper,miniature_pinscher,441,1929
678341075375947776,,,2015-12-19 22:28:09 +0000,http://twitter.com/download/iphone,This pupper likes tape. 12/10 https://t.co/cSp6w5GWgm,https://twitter.com/dog_rates/status/678341075375947776/photo/1,12.0,None,pupper,golden_retriever,566,1785
678334497360859136,,,2015-12-19 22:02:01 +0000,http://twitter.com/download/iphone,This is Rosie. She has a snazzy bow tie and a fin for a tail. Probably super fast underwater. Cool socks 10/10 https://t.co/GO76MdGBs0,https://twitter.com/dog_rates/status/678334497360859136/photo/1,10.0,Rosie,None,Norfolk_terrier,273,1345
678278586130948096,,,2015-12-19 18:19:51 +0000,http://twitter.com/download/iphone,Another spooky pupper here. Most definitely floating. No legs. Probably knows some dark magic. 10/10 very spooked https://t.co/JK8MByRzgj,https://twitter.com/dog_rates/status/678278586130948096/photo/1,10.0,None,pupper,Maltese_dog,6394,11820
678255464182861824,,,2015-12-19 16:47:58 +0000,http://twitter.com/download/iphone,This is Jessifer. She is a Bismoth Teriyaki. Flowers being attacked by hurricanes on bandana (rad). 9/10 stellar pup https://t.co/nZhmRwZzWv,https://twitter.com/dog_rates/status/678255464182861824/photo/1,9.0,Jessifer,None,Chihuahua,392,1635
678021115718029313,,,2015-12-19 01:16:45 +0000,http://twitter.com/download/iphone,This is Reese. He likes holding hands. 12/10 https://t.co/cbLroGCbmh,https://twitter.com/dog_rates/status/678021115718029313/photo/1,12.0,Reese,None,miniature_pinscher,6716,14157
677918531514703872,,,2015-12-18 18:29:07 +0000,http://twitter.com/download/iphone,"""Everything looks pretty good in there. Make sure to brush your gums. Been flossing? How's school going?"" Both 10/10 https://t.co/lWL2IMJqLR",https://twitter.com/dog_rates/status/677918531514703872/photo/1,10.0,None,None,Eskimo_dog,432,1398
677895101218201600,,,2015-12-18 16:56:01 +0000,http://twitter.com/download/iphone,Guys this was terrifying. Really spooked me up. We don't rate ghosts. We rate dogs. Please only send dogs... 9/10 https://t.co/EJImi1udYb,https://twitter.com/dog_rates/status/677895101218201600/photo/1,9.0,None,None,dalmatian,2220,4980
677700003327029250,,,2015-12-18 04:00:46 +0000,http://twitter.com/download/iphone,This is Ralph. He's an interpretive dancer. 10/10 https://t.co/zoDdPyPFsa,https://twitter.com/dog_rates/status/677700003327029250/photo/1,10.0,Ralph,None,Siberian_husky,1524,3497
677698403548192770,,,2015-12-18 03:54:25 +0000,http://twitter.com/download/iphone,This is Sadie. She got her holidays confused. 9/10 damn it Sadie https://t.co/fm7HxOsuPK,https://twitter.com/dog_rates/status/677698403548192770/photo/1,9.0,Sadie,None,Shih-Tzu,336,1266
677687604918272002,,,2015-12-18 03:11:30 +0000,http://twitter.com/download/iphone,This was Cindy's face when she heard Susan forgot the snacks for after the kid's soccer game. 11/10 https://t.co/gzkuVGRgAD,https://twitter.com/dog_rates/status/677687604918272002/photo/1,11.0,None,None,Pembroke,891,2555
677673981332312066,,,2015-12-18 02:17:22 +0000,http://twitter.com/download/iphone,Endangered triangular pup here. Could be a wizard. Caught mid-laugh. No legs. Just fluff. Probably a wizard. 9/10 https://t.co/GFVIHIod0Z,https://twitter.com/dog_rates/status/677673981332312066/photo/1,9.0,None,None,Maltese_dog,1574,3444
677644091929329666,,,2015-12-18 00:18:36 +0000,http://twitter.com/download/iphone,This is a dog swinging. I really enjoyed it so I hope you all do as well. 11/10 https://t.co/Ozo9KHTRND,https://twitter.com/dog_rates/status/677644091929329666/video/1,11.0,None,None,Chihuahua,837,1919
677565715327688705,,,2015-12-17 19:07:09 +0000,http://twitter.com/download/iphone,Contortionist pup here. Inside pentagram. Clearly worships Satan. Known to slowly push fragile stuff off tables 6/10 https://t.co/EX9oR55VMe,https://twitter.com/dog_rates/status/677565715327688705/photo/1,6.0,None,None,basset,480,1333
677547928504967168,,,2015-12-17 17:56:29 +0000,http://twitter.com/download/iphone,Not much to say here. I just think everyone needs to see this. 12/10 https://t.co/AGag0hFHpe,https://twitter.com/dog_rates/status/677547928504967168/photo/1,12.0,None,None,American_Staffordshire_terrier,3823,7132
677530072887205888,,,2015-12-17 16:45:31 +0000,http://twitter.com/download/iphone,Say hello to Axel. He's a Black Chevy Pinot on wheels. 0 to 60 in 5.7 seconds (if downhill). 9/10 I call shotgun https://t.co/DKe9DBnnHE,https://twitter.com/dog_rates/status/677530072887205888/photo/1,9.0,Axel,None,Staffordshire_bullterrier,238,1109
677334615166730240,,,2015-12-17 03:48:51 +0000,http://twitter.com/download/iphone,This dog gave up mid jump. 9/10 https://t.co/KmMv3Y2zI8,"https://twitter.com/dog_rates/status/677334615166730240/photo/1,https://twitter.com/dog_rates/status/677334615166730240/photo/1",9.0,None,None,Lakeland_terrier,307,1393
677331501395156992,,,2015-12-17 03:36:28 +0000,http://twitter.com/download/iphone,Meet Humphrey. He's a Northern Polyp Viagra. One ear works. Face stuck like that. Always surprised. 9/10 petable af https://t.co/FS7eJQM2F4,https://twitter.com/dog_rates/status/677331501395156992/photo/1,9.0,Humphrey,None,beagle,246,1128
677314812125323265,,,2015-12-17 02:30:09 +0000,http://twitter.com/download/iphone,"Meet Tassy &amp; Bee. Tassy is pretty chill, but Bee is convinced the Ruffles are haunted. 10/10 &amp; 11/10 respectively https://t.co/fgORpmTN9C","https://twitter.com/dog_rates/status/677314812125323265/photo/1,https://twitter.com/dog_rates/status/677314812125323265/photo/1",10.0,Tassy,None,Blenheim_spaniel,560,1688
677301033169788928,,,2015-12-17 01:35:24 +0000,http://twitter.com/download/iphone,This is Juckson. He's totally on his way to a nascar race. 5/10 for Juckson https://t.co/IoLRvF0Kak,https://twitter.com/dog_rates/status/677301033169788928/photo/1,5.0,Juckson,None,Japanese_spaniel,430,1279
677269281705472000,,,2015-12-16 23:29:14 +0000,http://twitter.com/download/iphone,This is the happiest pupper I've ever seen. 10/10 would trade lives with https://t.co/ep8ATEJwRb,https://twitter.com/dog_rates/status/677269281705472000/photo/1,10.0,the,pupper,Shetland_sheepdog,741,2055
677187300187611136,,,2015-12-16 18:03:28 +0000,http://twitter.com/download/iphone,Here we see a Byzantine Rigatoni. Very aerodynamic. No eyes. Actually not windy here they just look like that. 9/10 https://t.co/gzI0m6wXRo,https://twitter.com/dog_rates/status/677187300187611136/photo/1,9.0,None,None,English_setter,970,2807
676975532580409345,,,2015-12-16 04:01:59 +0000,http://twitter.com/download/iphone,This is Cooper. He doesn't know how cheese works. Likes the way it feels on his face. Cheeky tongue slip. 11/10 https://t.co/j1zczS0lI5,https://twitter.com/dog_rates/status/676975532580409345/photo/1,11.0,Cooper,None,malamute,1123,2862
676957860086095872,,,2015-12-16 02:51:45 +0000,http://twitter.com/download/iphone,10/10 I'd follow this dog into battle no questions asked https://t.co/ngTNXYQF0L,https://twitter.com/dog_rates/status/676957860086095872/video/1,10.0,None,None,Labrador_retriever,847,2273
676949632774234114,,,2015-12-16 02:19:04 +0000,http://twitter.com/download/iphone,This is Tyrus. He's a Speckled Centennial Ticonderoga. Terrified of floating red ball. Nifty bandana. 8/10 v petable https://t.co/HqM3YhCaaa,https://twitter.com/dog_rates/status/676949632774234114/photo/1,8.0,Tyrus,None,Welsh_springer_spaniel,418,1346
676946864479084545,,,2015-12-16 02:08:04 +0000,http://twitter.com/download/iphone,This pups goal was to get all four feet as close to each other as possible. Valiant effort 12/10 https://t.co/2mXALbgBTV,https://twitter.com/dog_rates/status/676946864479084545/photo/1,12.0,None,None,Pekinese,394,1757
676864501615042560,,,2015-12-15 20:40:47 +0000,http://twitter.com/download/iphone,Meet Ash. He's just a head now. Lost his body during the Third Crusade. Still in good spirits. 10/10 would pet well https://t.co/NJj2uP0atK,https://twitter.com/dog_rates/status/676864501615042560/photo/1,10.0,Ash,None,Chesapeake_Bay_retriever,741,2156
