tweet_id,in_reply_to_status_id,in_reply_to_user_id,timestamp,source,text,expanded_urls,rating_numerator,name,dog_stage,dog_breed,retweet_count,favorite_count
802572683846291456,,,2016-11-26 18:00:13 +0000,http://twitter.com/download/iphone,This is Winnie. She's h*ckin ferocious. Dandelion doesn't even see her coming. 12/10 would pet with caution https://t.co/EFfLCP7oQv,https://twitter.com/dog_rates/status/802572683846291456/photo/1,12.0,Winnie,None,golden_retriever,2715,9498
802239329049477120,,,2016-11-25 19:55:35 +0000,http://twitter.com/download/iphone,This is Loki. He'll do your taxes for you. Can also make room in your budget for all the things you bought today. 12/10 what a puppo https://t.co/5oWrHCWg87,"https://twitter.com/dog_rates/status/802239329049477120/photo/1,https://twitter.com/dog_rates/status/802239329049477120/photo/1",12.0,Loki,puppo,Eskimo_dog,2839,9631
801958328846974976,,,2016-11-25 01:18:59 +0000,http://twitter.com/download/iphone,This is Ronnie. He hopes you're having a great day. Nifty tongue slip. 12/10 would pat head approvingly https://t.co/4fY2bsAm65,https://twitter.com/dog_rates/status/801958328846974976/photo/1,12.0,Ronnie,None,Staffordshire_bullterrier,1858,8190
801538201127157760,,,2016-11-23 21:29:33 +0000,http://twitter.com/download/iphone,This is Wallace. He'll be your chau-fur this evening. 12/10 eyes on the road Wallace https://t.co/p1RD39XjUe,https://twitter.com/dog_rates/status/801538201127157760/photo/1,12.0,Wallace,None,Pembroke,2230,8713
801115127852503040,,,2016-11-22 17:28:25 +0000,http://twitter.com/download/iphone,This is Bones. He's being haunted by another doggo of roughly the same size. 12/10 deep breaths pupper everything's fine https://t.co/55Dqe0SJNj,"https://twitter.com/dog_rates/status/801115127852503040/photo/1,https://twitter.com/dog_rates/status/801115127852503040/photo/1",12.0,Bones,pupper,dalmatian,2270,8585
800751577355128832,,,2016-11-21 17:23:47 +0000,http://twitter.com/download/iphone,Say hello to Mauve and Murphy. They're rather h*ckin filthy. Preferred nap over bath. Both 12/10 https://t.co/4UwCTW3lXG,"https://twitter.com/dog_rates/status/800751577355128832/photo/1,https://twitter.com/dog_rates/status/800751577355128832/photo/1,https://twitter.com/dog_rates/status/800751577355128832/photo/1",12.0,Mauve,None,cocker_spaniel,3013,11167
800513324630806528,,,2016-11-21 01:37:04 +0000,http://twitter.com/download/iphone,This is Chef. Chef loves everyone and wants everyone to love each other. 11/10 https://t.co/ILHGs0e6Dm,https://twitter.com/dog_rates/status/800513324630806528/photo/1,11.0,Chef,None,Pembroke,3277,13965
800388270626521089,,,2016-11-20 17:20:08 +0000,http://twitter.com/download/iphone,This is Doc. He takes time out of every day to worship our plant overlords. 12/10 quite the floofer https://t.co/azMneS6Ly5,"https://twitter.com/dog_rates/status/800388270626521089/photo/1,https://twitter.com/dog_rates/status/800388270626521089/photo/1,https://twitter.com/dog_rates/status/800388270626521089/photo/1",12.0,Doc,floofer,golden_retriever,3055,11842
799774291445383169,,,2016-11-19 00:40:24 +0000,http://twitter.com/download/iphone,RT @dog_rates: This is Tucker. He would like a hug. 13/10 someone hug him https://t.co/wdgY9oHPrT,"https://twitter.com/dog_rates/status/775085132600442880/photo/1,https://twitter.com/dog_rates/status/775085132600442880/photo/1",13.0,Tucker,None,chow,5086,0
799757965289017345,,,2016-11-18 23:35:32 +0000,http://twitter.com/download/iphone,This is Sobe. She's a h*ckin happy doggo. Only one leg tho. Must have good balance. 13/10 would smile back https://t.co/OiH8PaOxB1,"https://twitter.com/dog_rates/status/799757965289017345/photo/1,https://twitter.com/dog_rates/status/799757965289017345/photo/1,https://twitter.com/dog_rates/status/799757965289017345/photo/1,https://twitter.com/dog_rates/status/799757965289017345/photo/1",13.0,Sobe,doggo,Border_collie,2354,8930
799422933579902976,,,2016-11-18 01:24:14 +0000,http://twitter.com/download/iphone,This is Longfellow (prolly sophisticated). He's a North Appalachian Oatzenjammer. Concerned about wrinkled feets. 12/10 would hug softly https://t.co/bpLuQuxzHZ,https://twitter.com/dog_rates/status/799422933579902976/photo/1,12.0,Longfellow,None,miniature_pinscher,2081,8554
799297110730567681,,,2016-11-17 17:04:16 +0000,http://twitter.com/download/iphone,This is Jeffrey. He's quite the jokester. Takes it too far sometimes. Still 11/10 would pet https://t.co/YDtZcAiMAf,"https://twitter.com/dog_rates/status/799297110730567681/photo/1,https://twitter.com/dog_rates/status/799297110730567681/photo/1",11.0,Jeffrey,None,malamute,3010,10518
799063482566066176,,,2016-11-17 01:35:54 +0000,http://twitter.com/download/iphone,This is Mister. He only wears the most fashionable af headwear. 11/10 h*ckin stylish https://t.co/BXJFKOVnJm,"https://twitter.com/dog_rates/status/799063482566066176/photo/1,https://twitter.com/dog_rates/status/799063482566066176/photo/1,https://twitter.com/dog_rates/status/799063482566066176/photo/1,https://twitter.com/dog_rates/status/799063482566066176/photo/1",11.0,Mister,None,Norfolk_terrier,2681,8582
798933969379225600,,,2016-11-16 17:01:16 +0000,http://twitter.com/download/iphone,This is Iroh. He's in a predicament. 12/10 someone help him https://t.co/KJAKO2kXsL,"https://twitter.com/dog_rates/status/798933969379225600/photo/1,https://twitter.com/dog_rates/status/798933969379225600/photo/1",12.0,Iroh,None,Siberian_husky,4865,13964
798925684722855936,,,2016-11-16 16:28:21 +0000,http://twitter.com/download/iphone,This is Shadow. He's a firm believer that they're all good dogs. H*ckin passionate about it too. 11/10 I stand with Shadow https://t.co/8yvpacwBcu,https://twitter.com/dog_rates/status/798925684722855936/photo/1,11.0,Shadow,None,West_Highland_white_terrier,1553,7915
798697898615730177,,,2016-11-16 01:23:12 +0000,http://twitter.com/download/iphone,RT @dog_rates: This is Stubert. He just arrived. 10/10 https://t.co/HVGs5aAKAn,"https://twitter.com/dog_rates/status/712809025985978368/photo/1,https://twitter.com/dog_rates/status/712809025985978368/photo/1",10.0,Stubert,None,Labrador_retriever,7071,0
798694562394996736,,,2016-11-16 01:09:57 +0000,http://twitter.com/download/iphone,"RT @dog_rates: I'm not sure what's happening here, but it's pretty spectacular. 12/10 for both https://t.co/JKXh0NbBNL","https://twitter.com/dog_rates/status/701214700881756160/photo/1,https://twitter.com/dog_rates/status/701214700881756160/photo/1",12.0,None,None,Chihuahua,5387,0
798665375516884993,,,2016-11-15 23:13:58 +0000,http://twitter.com/download/iphone,RT @dog_rates: This is Lola. She fell asleep on a piece of pizza. 10/10 frighteningly relatable https://t.co/eqmkr2gmPH,"https://twitter.com/dog_rates/status/671896809300709376/photo/1,https://twitter.com/dog_rates/status/671896809300709376/photo/1",10.0,Lola,None,chow,4241,0
798644042770751489,,,2016-11-15 21:49:12 +0000,http://twitter.com/download/iphone,RT @dog_rates: This is Paull. He just stubbed his toe. 10/10 deep breaths Paull https://t.co/J5Mqn8VeYq,"https://twitter.com/dog_rates/status/670444955656130560/photo/1,https://twitter.com/dog_rates/status/670444955656130560/photo/1",10.0,Paull,None,English_springer,2014,0
798628517273620480,,,2016-11-15 20:47:30 +0000,http://twitter.com/download/iphone,RT @dog_rates: This a Norwegian Pewterschmidt named Tickles. Ears for days. 12/10 I care deeply for Tickles https://t.co/0aDF62KVP7,"https://twitter.com/dog_rates/status/667509364010450944/photo/1,https://twitter.com/dog_rates/status/667509364010450944/photo/1",12.0,None,None,beagle,2140,0
798340744599797760,,,2016-11-15 01:44:00 +0000,http://twitter.com/download/iphone,RT @dog_rates: This is Davey. He'll have your daughter home by 8. Just a stand up pup. 11/10 would introduce to mom https://t.co/E6bGWf9EOm,"https://twitter.com/dog_rates/status/771770456517009408/photo/1,https://twitter.com/dog_rates/status/771770456517009408/photo/1",11.0,Davey,None,papillon,3648,0
798209839306514432,,,2016-11-14 17:03:50 +0000,http://twitter.com/download/iphone,This is Cooper. His bow tie was too heavy for the front so he moved it to the side. Balanced af now. 13/10 https://t.co/jG1PAFkB81,https://twitter.com/dog_rates/status/798209839306514432/photo/1,13.0,Cooper,None,Pekinese,2776,11036
797971864723324932,,,2016-11-14 01:18:12 +0000,http://twitter.com/download/iphone,Here's a helicopter pupper. He takes off at random. H*ckin hard to control. 12/10 rare af https://t.co/GRWPgNKt2z,"https://twitter.com/dog_rates/status/797971864723324932/photo/1,https://twitter.com/dog_rates/status/797971864723324932/photo/1",12.0,None,pupper,American_Staffordshire_terrier,3418,12383
797545162159308800,,,2016-11-12 21:02:38 +0000,http://twitter.com/download/iphone,This is Cassie. She steals things. Guilt increases slightly each time. 12/10 would forgive almost immediately https://t.co/Ia19irLwyB,"https://twitter.com/dog_rates/status/797545162159308800/photo/1,https://twitter.com/dog_rates/status/797545162159308800/photo/1,https://twitter.com/dog_rates/status/797545162159308800/photo/1,https://twitter.com/dog_rates/status/797545162159308800/photo/1",12.0,Cassie,None,Pembroke,5276,15429
797236660651966464,,,2016-11-12 00:36:46 +0000,http://twitter.com/download/iphone,This is Pancake. She loves Batman and winks like a h*ckin champ. 12/10 real crowd pleaser https://t.co/6kqsAjJNhi,"https://twitter.com/dog_rates/status/797236660651966464/photo/1,https://twitter.com/dog_rates/status/797236660651966464/photo/1",12.0,Pancake,None,collie,7225,21228
796865951799083009,,,2016-11-11 00:03:42 +0000,http://twitter.com/download/iphone,This is Tyr. He's just checking on you. Nifty af tongue slip. 12/10 would absolutely pet https://t.co/Jgnuiyvq06,https://twitter.com/dog_rates/status/796865951799083009/photo/1,12.0,Tyr,None,Cardigan,2071,8147
796759840936919040,,,2016-11-10 17:02:03 +0000,http://twitter.com/download/iphone,Say hello to Romeo. He was just told that it's too cold for the pool. H*ckin nonsense. 11/10 would help fill up https://t.co/6hx7ur6sNI,"https://twitter.com/dog_rates/status/796759840936919040/photo/1,https://twitter.com/dog_rates/status/796759840936919040/photo/1",11.0,Romeo,None,American_Staffordshire_terrier,3317,12596
796484825502875648,,,2016-11-09 22:49:15 +0000,http://twitter.com/download/iphone,Here's a sleepy doggo that requested some assistance. 12/10 would carry everywhere https://t.co/bvkkqOjNDV,https://twitter.com/dog_rates/status/796484825502875648/photo/1,12.0,None,doggo,cocker_spaniel,1920,8051
796387464403357696,,,2016-11-09 16:22:22 +0000,http://twitter.com/download/iphone,This is Snicku. He's having trouble reading because he's a dog. Glasses only helped a little. Nap preferred. 12/10 would snug well https://t.co/cVLUasbKA5,"https://twitter.com/dog_rates/status/796387464403357696/photo/1,https://twitter.com/dog_rates/status/796387464403357696/photo/1",12.0,Snicku,None,Pekinese,4527,11694
796177847564038144,,,2016-11-09 02:29:25 +0000,http://twitter.com/download/iphone,RT @dog_rates: This is Ruby. She just turned on the news. Officially terrified. 11/10 deep breaths Ruby https://t.co/y5KarNXWXt,"https://twitter.com/dog_rates/status/796149749086875649/photo/1,https://twitter.com/dog_rates/status/796149749086875649/photo/1,https://twitter.com/dog_rates/status/796149749086875649/photo/1,https://twitter.com/dog_rates/status/796149749086875649/photo/1",11.0,Ruby,None,golden_retriever,15572,0
796149749086875649,,,2016-11-09 00:37:46 +0000,http://twitter.com/download/iphone,This is Ruby. She just turned on the news. Officially terrified. 11/10 deep breaths Ruby https://t.co/y5KarNXWXt,"https://twitter.com/dog_rates/status/796149749086875649/photo/1,https://twitter.com/dog_rates/status/796149749086875649/photo/1",11.0,Ruby,None,golden_retriever,15572,34343
796116448414461957,,,2016-11-08 22:25:27 +0000,http://twitter.com/download/iphone,I didn't believe it at first but now I can see that voter fraud is a serious h*ckin issue. 11/10 https://t.co/7i0bDMbrVN,https://twitter.com/dog_rates/status/796116448414461957/photo/1,11.0,None,None,Cardigan,2633,9680
796080075804475393,,,2016-11-08 20:00:55 +0000,http://twitter.com/download/iphone,This is Yogi. He's 98% floof. Snuggable af. 12/10 https://t.co/opoXKxmfFm,https://twitter.com/dog_rates/status/796080075804475393/photo/1,12.0,Yogi,None,chow,2520,8998
796031486298386433,,,2016-11-08 16:47:50 +0000,http://twitter.com/download/iphone,This is Daisy. She's here to make your day better. 13/10 mission h*ckin successful https://t.co/PbgvuD0qIL,https://twitter.com/dog_rates/status/796031486298386433/photo/1,13.0,Daisy,None,golden_retriever,4004,11511
795464331001561088,,,2016-11-07 03:14:10 +0000,http://twitter.com/download/iphone,Elder doggo does a splash. Both 13/10 incredible stuff https://t.co/gBUDjdEcqz,https://twitter.com/dog_rates/status/795464331001561088/video/1,13.0,None,doggo,golden_retriever,25915,52883
795400264262053889,,,2016-11-06 22:59:35 +0000,http://twitter.com/download/iphone,This is Brody. He's trying to make the same face as the football. 12/10 https://t.co/2H4MfOGlpQ,"https://twitter.com/dog_rates/status/795400264262053889/photo/1,https://twitter.com/dog_rates/status/795400264262053889/photo/1,https://twitter.com/dog_rates/status/795400264262053889/photo/1,https://twitter.com/dog_rates/status/795400264262053889/photo/1",12.0,Brody,None,golden_retriever,3121,10720
794983741416415232,,,2016-11-05 19:24:28 +0000,http://twitter.com/download/iphone,RT @dog_rates: This is Rizzy. She smiles a lot. 12/10 contagious af https://t.co/TU4sZogVIq,"https://twitter.com/dog_rates/status/789530877013393408/photo/1,https://twitter.com/dog_rates/status/789530877013393408/photo/1,https://twitter.com/dog_rates/status/789530877013393408/photo/1,https://twitter.com/dog_rates/status/789530877013393408/photo/1,https://twitter.com/dog_rates/status/789530877013393408/photo/1,https://twitter.com/dog_rates/status/789530877013393408/photo/1",12.0,Rizzy,None,schipperke,3668,0
794355576146903043,,,2016-11-04 01:48:22 +0000,http://twitter.com/download/iphone,RT @dog_rates: This is Butter. She can have whatever she wants forever. 12/10 would hug softly https://t.co/x5gXRS1abq,"https://twitter.com/dog_rates/status/788765914992902144/photo/1,https://twitter.com/dog_rates/status/788765914992902144/photo/1",12.0,Butter,None,cocker_spaniel,11195,0
794332329137291264,,,2016-11-04 00:15:59 +0000,http://twitter.com/download/iphone,This is Nimbus (like the cloud). He just bought this fancy af duck raincoat. Only protects one ear tho. 12/10 so h*ckin floofy https://t.co/SIQbb8c3AU,https://twitter.com/dog_rates/status/794332329137291264/photo/1,12.0,Nimbus,None,Samoyed,2889,10191
793845145112371200,,,2016-11-02 16:00:06 +0000,http://twitter.com/download/iphone,This is Clark. He was just caught wearing pants. 13/10 game-changing af https://t.co/2Xo19aPrG5,https://twitter.com/dog_rates/status/793845145112371200/photo/1,13.0,Clark,None,Old_English_sheepdog,2038,9790
793614319594401792,,,2016-11-02 00:42:53 +0000,http://twitter.com/download/iphone,RT @dog_rates: When she says you're a good boy and you know you're a good boy because you're a good boy. 13/10 https://t.co/O5IUmRHRIh,"https://twitter.com/dog_rates/status/791672322847637504/photo/1,https://twitter.com/dog_rates/status/791672322847637504/photo/1",13.0,None,None,golden_retriever,3395,0
793601777308463104,,,2016-11-01 23:53:02 +0000,http://twitter.com/download/iphone,This is Dobby. I can't stop looking at her feet. 12/10 would absolutely snug https://t.co/LhzPWv6rTv,https://twitter.com/dog_rates/status/793601777308463104/photo/1,12.0,Dobby,None,miniature_pinscher,1772,8478
793500921481273345,,,2016-11-01 17:12:16 +0000,http://twitter.com/download/iphone,This is Fiona. She's an extremely mediocre copilot. Very distracting. Wink makes up for all the missed turns. 12/10 https://t.co/aF5MmpvPqN,"https://twitter.com/dog_rates/status/793500921481273345/photo/1,https://twitter.com/dog_rates/status/793500921481273345/photo/1",12.0,Fiona,None,golden_retriever,2586,11369
793271401113350145,,,2016-11-01 02:00:14 +0000,http://twitter.com/download/iphone,Meet Dave. It's his favorite day of the year. He gets to fulfill his dream of being a dinosaur. 12/10 inspirational af https://t.co/MgQSdfZGPN,https://twitter.com/dog_rates/status/793271401113350145/photo/1,12.0,Dave,None,Siberian_husky,2581,9207
793256262322548741,,,2016-11-01 01:00:05 +0000,http://twitter.com/download/iphone,Oh h*ck look at this spookling right here. Fright level off the charts. 12/10 sufficiently spooked https://t.co/BNy9IIJMb0,https://twitter.com/dog_rates/status/793256262322548741/photo/1,12.0,None,None,basset,9074,21239
793241302385262592,,,2016-11-01 00:00:38 +0000,http://twitter.com/download/iphone,This is Tucker. He's out here bustin h*ckin ghosts. 13/10 dedicated af https://t.co/Ap477GhwXt,https://twitter.com/dog_rates/status/793241302385262592/photo/1,13.0,Tucker,None,golden_retriever,3562,11175
793226087023144960,,,2016-10-31 23:00:11 +0000,http://twitter.com/download/iphone,"This is Juno. She spooked me up real good, but only to get my attention. Above average handwriting for a dog I think. 11/10 https://t.co/hFxxBCWlwj","https://twitter.com/dog_rates/status/793226087023144960/photo/1,https://twitter.com/dog_rates/status/793226087023144960/photo/1,https://twitter.com/dog_rates/status/793226087023144960/photo/1",11.0,Juno,None,wire-haired_fox_terrier,3111,10454
793195938047070209,,,2016-10-31 21:00:23 +0000,http://twitter.com/download/iphone,Say hello to Lily. She's pupset that her costume doesn't fit as well as last year. 12/10 poor puppo https://t.co/YSi6K1firY,"https://twitter.com/dog_rates/status/793195938047070209/photo/1,https://twitter.com/dog_rates/status/793195938047070209/photo/1",12.0,Lily,puppo,Labrador_retriever,6126,16232
793180763617361921,,,2016-10-31 20:00:05 +0000,http://twitter.com/download/iphone,This is Newt. He's a strawberry. 11/10 https://t.co/2VhmlwxA1Q,https://twitter.com/dog_rates/status/793180763617361921/photo/1,11.0,Newt,None,Lakeland_terrier,2165,7370
793165685325201412,,,2016-10-31 19:00:10 +0000,http://twitter.com/download/iphone,This is Benji. He's Air Bud. It's a low effort costume but he pulls it off rather h*ckin well. 12/10 would happily get dunked on https://t.co/IbzT7DJvBo,https://twitter.com/dog_rates/status/793165685325201412/photo/1,12.0,Benji,None,golden_retriever,3024,10009
793150605191548928,,,2016-10-31 18:00:14 +0000,http://twitter.com/download/iphone,This is Nida. She's a free elf. Waited so long for this day. 11/10 https://t.co/3lE8Izgmkf,https://twitter.com/dog_rates/status/793150605191548928/photo/1,11.0,Nida,None,Italian_greyhound,1850,6559
793120401413079041,,,2016-10-31 16:00:13 +0000,http://twitter.com/download/iphone,"This is Robin. She's desperately trying to do me a frighten, but her tongue drastically decreases her spook value. Still 11/10 great effort https://t.co/sxMrsOZ8zb",https://twitter.com/dog_rates/status/793120401413079041/photo/1,11.0,Robin,None,Labrador_retriever,4249,13487
792773781206999040,,,2016-10-30 17:02:53 +0000,http://twitter.com/download/iphone,This is Monster. Not an actual monster tho. He's showing you his tongue. Very impressive Monster. 12/10 would snug https://t.co/RhaPExuxJL,https://twitter.com/dog_rates/status/792773781206999040/photo/1,12.0,Monster,None,Yorkshire_terrier,1825,7801
792394556390137856,,,2016-10-29 15:55:58 +0000,http://twitter.com/download/iphone,Meet BeBe. She rocks the messy bun of your dreams. H*ckin flawless. 12/10 would watch her tutorial https://t.co/of0pFNBIl8,"https://twitter.com/dog_rates/status/792394556390137856/photo/1,https://twitter.com/dog_rates/status/792394556390137856/photo/1",12.0,BeBe,None,cocker_spaniel,4668,14292
792050063153438720,,,2016-10-28 17:07:05 +0000,http://twitter.com/download/iphone,This is Remus. He's a mop that came to life. Can't see anything. Constantly trips over himself. Still a very good dog. 11/10 https://t.co/S3f1SYylzu,"https://twitter.com/dog_rates/status/792050063153438720/photo/1,https://twitter.com/dog_rates/status/792050063153438720/photo/1",11.0,Remus,None,komondor,1964,7623
791312159183634433,,,2016-10-26 16:14:55 +0000,http://twitter.com/download/iphone,This is Mabel. She's super h*ckin smol. Portable af. Comes with the smol shoe. 12/10 would keep in frocket https://t.co/GGJvxYt3xK,"https://twitter.com/dog_rates/status/791312159183634433/photo/1,https://twitter.com/dog_rates/status/791312159183634433/photo/1,https://twitter.com/dog_rates/status/791312159183634433/photo/1,https://twitter.com/dog_rates/status/791312159183634433/photo/1",12.0,Mabel,None,miniature_pinscher,2761,9341
791026214425268224,,,2016-10-25 21:18:40 +0000,http://twitter.com/download/iphone,RT @dog_rates: This is Alfie. He's touching a butt. Couldn't be happier. 11/10 https://t.co/gx3xF5mZbo,"https://twitter.com/dog_rates/status/763837565564780549/photo/1,https://twitter.com/dog_rates/status/763837565564780549/photo/1",11.0,Alfie,None,malamute,4467,0
790987426131050500,,,2016-10-25 18:44:32 +0000,http://twitter.com/download/iphone,This is Misty. She has a cowboy hat on her nose. 12/10 https://t.co/Eno0mypHIr,https://twitter.com/dog_rates/status/790987426131050500/photo/1,12.0,Misty,None,cocker_spaniel,2322,10497
790698755171364864,,,2016-10-24 23:37:28 +0000,http://twitter.com/download/iphone,This is Mosby. He appears to be rather h*ckin snuggable af. 12/10 keep it up Mosby https://t.co/IiiBq460I7,https://twitter.com/dog_rates/status/790698755171364864/photo/1,12.0,Mosby,None,Bernese_mountain_dog,2078,8710
790337589677002753,,,2016-10-23 23:42:19 +0000,http://twitter.com/download/iphone,Meet Maggie. She can hear your cells divide. 12/10 can also probably fly https://t.co/ovE2hqXryV,https://twitter.com/dog_rates/status/790337589677002753/photo/1,12.0,Maggie,None,Pembroke,2025,8304
790277117346975746,,,2016-10-23 19:42:02 +0000,http://twitter.com/download/iphone,This is Bruce. He never backs down from a challenge. 11/10 you got this Bruce https://t.co/aI7umZHIq7,https://twitter.com/dog_rates/status/790277117346975746/photo/1,11.0,Bruce,None,Labrador_retriever,3460,13344
789628658055020548,,,2016-10-22 00:45:17 +0000,http://twitter.com/download/iphone,This is Eli. He can fly. 13/10 magical af https://t.co/huPSJJ7FDI,https://twitter.com/dog_rates/status/789628658055020548/photo/1,13.0,Eli,None,chow,1936,7974
789599242079838210,,,2016-10-21 22:48:24 +0000,http://twitter.com/download/iphone,This is Brownie. She's wearing a Halloween themed onesie. 12/10 festive af https://t.co/0R4meWXFOx,"https://twitter.com/dog_rates/status/789599242079838210/photo/1,https://twitter.com/dog_rates/status/789599242079838210/photo/1",12.0,Brownie,None,Chesapeake_Bay_retriever,2104,7185
789268448748703744,,,2016-10-21 00:53:56 +0000,http://twitter.com/download/iphone,This is Stella. She's happier than I will ever be. 10/10 would trade lives with https://t.co/JSs2bfDtTS,https://twitter.com/dog_rates/status/789268448748703744/photo/1,10.0,Stella,None,malamute,2813,9683
789137962068021249,,,2016-10-20 16:15:26 +0000,http://twitter.com/download/iphone,This is Bo. He's a West Congolese Bugaboop Snuggle. Rather exotic. Master of the head tilt. 12/10 would pay to pet https://t.co/2jwxxtNzoN,"https://twitter.com/dog_rates/status/789137962068021249/photo/1,https://twitter.com/dog_rates/status/789137962068021249/photo/1,https://twitter.com/dog_rates/status/789137962068021249/photo/1",12.0,Bo,None,Chihuahua,3042,10313
788412144018661376,,,2016-10-18 16:11:17 +0000,http://twitter.com/download/iphone,This is Dexter. He breaks hearts for a living. 11/10 h*ckin handsome af https://t.co/4DhSsC1W7S,"https://twitter.com/dog_rates/status/788412144018661376/photo/1,https://twitter.com/dog_rates/status/788412144018661376/photo/1",11.0,Dexter,None,golden_retriever,5751,16542
788178268662984705,,,2016-10-18 00:41:57 +0000,http://twitter.com/download/iphone,Atlas is back and this time he's got doggles. Still 13/10 solarly conscious af https://t.co/s7MgFWDySc,"https://twitter.com/dog_rates/status/788178268662984705/photo/1,https://twitter.com/dog_rates/status/788178268662984705/photo/1,https://twitter.com/dog_rates/status/788178268662984705/photo/1,https://twitter.com/dog_rates/status/788178268662984705/photo/1",13.0,None,None,Samoyed,2301,7672
788150585577050112,,,2016-10-17 22:51:57 +0000,http://twitter.com/download/iphone,This is Leo. He's a golden chow. Rather h*ckin rare. 13/10 would give extra pats https://t.co/xosHjFzVXc,"https://twitter.com/dog_rates/status/788150585577050112/photo/1,https://twitter.com/dog_rates/status/788150585577050112/photo/1,https://twitter.com/dog_rates/status/788150585577050112/photo/1,https://twitter.com/dog_rates/status/788150585577050112/photo/1",13.0,Leo,None,chow,1416,6530
788070120937619456,,,2016-10-17 17:32:13 +0000,http://twitter.com/download/iphone,RT @dog_rates: This is Bo and Ty. Bo eats paper and Ty felt left out. 11/10 for both https://t.co/1acHQS8rvK,"https://twitter.com/dog_rates/status/761004547850530816/photo/1,https://twitter.com/dog_rates/status/761004547850530816/photo/1",11.0,Bo,None,golden_retriever,3718,0
787810552592695296,,,2016-10-17 00:20:47 +0000,http://twitter.com/download/iphone,This is Frank. He wears sunglasses and walks himself. 11/10 I'll never be this cool or independent https://t.co/pNNjBtHWPc,"https://twitter.com/dog_rates/status/787810552592695296/photo/1,https://twitter.com/dog_rates/status/787810552592695296/photo/1",11.0,Frank,None,pug,3322,9196
