tweet_id,in_reply_to_status_id,in_reply_to_user_id,timestamp,source,text,expanded_urls,rating_numerator,name,dog_stage,dog_breed,retweet_count,favorite_count
892177421306343426,,,2017-08-01 00:17:27 +0000,http://twitter.com/download/iphone,"This is Tilly. She's just checking pup on you. Hopes you're doing ok. If not, she's available for pats, snugs, boops, the whole bit. 13/10 https://t.co/0Xxu71qeIV",https://twitter.com/dog_rates/status/892177421306343426/photo/1,13.0,Tilly,None,Chihuahua,6077,32404
891815181378084864,,,2017-07-31 00:18:03 +0000,http://twitter.com/download/iphone,This is Archie. He is a rare Norwegian Pouncing Corgo. Lives in the tall grass. You never know when one may strike. 12/10 https://t.co/wUnZnhtVJB,https://twitter.com/dog_rates/status/891815181378084864/photo/1,12.0,Archie,None,Chihuahua,4022,24401
891327558926688256,,,2017-07-29 16:00:24 +0000,http://twitter.com/download/iphone,"This is Franklin. He would like you to stop calling him ""cute."" He is a very fierce shark and should be respected as such. 12/10 #BarkWeek https://t.co/AtUZn91f7f","https://twitter.com/dog_rates/status/891327558926688256/photo/1,https://twitter.com/dog_rates/status/891327558926688256/photo/1",12.0,Franklin,None,basset,9079,39238
891087950875897856,,,2017-07-29 00:08:17 +0000,http://twitter.com/download/iphone,Here we have a majestic great white breaching off South Africa's coast. Absolutely h*ckin breathtaking. 13/10 (IG: tucker_marlo) #BarkWeek https://t.co/kQ04fDDRmh,https://twitter.com/dog_rates/status/891087950875897856/photo/1,13.0,None,None,Chesapeake_Bay_retriever,3011,19727
890971913173991426,,,2017-07-28 16:27:12 +0000,http://twitter.com/download/iphone,"Meet Jax. He enjoys ice cream so much he gets nervous around it. 13/10 help Jax enjoy more things by clicking below

https://t.co/Zr4hWfAs1H https://t.co/tVJBRMnhxl","https://gofundme.com/ydvmve-surgery-for-jax,https://twitter.com/dog_rates/status/890971913173991426/photo/1",13.0,Jax,None,Appenzeller,1989,11535
890729181411237888,,,2017-07-28 00:22:40 +0000,http://twitter.com/download/iphone,When you watch your owner call another dog a good boy but then they turn back to you and say you're a great boy. 13/10 https://t.co/v0nONBcwxq,"https://twitter.com/dog_rates/status/890729181411237888/photo/1,https://twitter.com/dog_rates/status/890729181411237888/photo/1",13.0,None,None,Pomeranian,18271,63635
890609185150312448,,,2017-07-27 16:25:51 +0000,http://twitter.com/download/iphone,This is Zoey. She doesn't want to be one of the scary sharks. Just wants to be a snuggly pettable boatpet. 13/10 #BarkWeek https://t.co/9TwLuAGH0b,https://twitter.com/dog_rates/status/890609185150312448/photo/1,13.0,Zoey,None,Irish_terrier,4137,27112
890240255349198849,,,2017-07-26 15:59:51 +0000,http://twitter.com/download/iphone,This is Cassie. She is a college pup. Studying international doggo communication and stick theory. 14/10 so elegant much sophisticate https://t.co/t1bfwz5S2A,https://twitter.com/dog_rates/status/890240255349198849/photo/1,14.0,Cassie,doggo,Pembroke,7141,31104
890006608113172480,,,2017-07-26 00:31:25 +0000,http://twitter.com/download/iphone,This is Koda. He is a South Australian deckshark. Deceptively deadly. Frighteningly majestic. 13/10 would risk a petting #BarkWeek https://t.co/dVPW0B0Mme,"https://twitter.com/dog_rates/status/890006608113172480/photo/1,https://twitter.com/dog_rates/status/890006608113172480/photo/1",13.0,Koda,None,Samoyed,7098,29898
889880896479866881,,,2017-07-25 16:11:53 +0000,http://twitter.com/download/iphone,This is Bruno. He is a service shark. Only gets out of the water to assist you. 13/10 terrifyingly good boy https://t.co/u1XPQMl29g,https://twitter.com/dog_rates/status/889880896479866881/photo/1,13.0,Bruno,None,French_bulldog,4820,27101
889665388333682689,,,2017-07-25 01:55:32 +0000,http://twitter.com/download/iphone,Here's a puppo that seems to be on the fence about something haha no but seriously someone help her. 13/10 https://t.co/BxvuXk0UCm,https://twitter.com/dog_rates/status/889665388333682689/photo/1,13.0,None,puppo,Pembroke,9719,46871
889638837579907072,,,2017-07-25 00:10:02 +0000,http://twitter.com/download/iphone,This is Ted. He does his best. Sometimes that's not enough. But it's ok. 12/10 would assist https://t.co/f8dEDcrKSR,"https://twitter.com/dog_rates/status/889638837579907072/photo/1,https://twitter.com/dog_rates/status/889638837579907072/photo/1",12.0,Ted,None,French_bulldog,4385,26431
889531135344209921,,,2017-07-24 17:02:04 +0000,http://twitter.com/download/iphone,This is Stuart. He's sporting his favorite fanny pack. Secretly filled with bones only. 13/10 puppared puppo #BarkWeek https://t.co/y70o6h3isq,https://twitter.com/dog_rates/status/889531135344209921/photo/1,13.0,Stuart,puppo,golden_retriever,2180,14738
889278841981685760,,,2017-07-24 00:19:32 +0000,http://twitter.com/download/iphone,This is Oliver. You're witnessing one of his many brutal attacks. Seems to be playing with his victim. 13/10 fr*ckin frightening #BarkWeek https://t.co/WpHvrQedPb,https://twitter.com/dog_rates/status/889278841981685760/video/1,13.0,Oliver,None,whippet,5204,24598
888917238123831296,,,2017-07-23 00:22:39 +0000,http://twitter.com/download/iphone,This is Jim. He found a fren. Taught him how to sit like the good boys. 12/10 for both https://t.co/chxruIOUJN,https://twitter.com/dog_rates/status/888917238123831296/photo/1,12.0,Jim,None,golden_retriever,4365,28386
888804989199671297,,,2017-07-22 16:56:37 +0000,http://twitter.com/download/iphone,This is Zeke. He has a new stick. Very proud of it. Would like you to throw it for him without taking it. 13/10 would do my best https://t.co/HTQ77yNQ5K,"https://twitter.com/dog_rates/status/888804989199671297/photo/1,https://twitter.com/dog_rates/status/888804989199671297/photo/1",13.0,Zeke,None,golden_retriever,4145,24908
888554962724278272,,,2017-07-22 00:23:06 +0000,http://twitter.com/download/iphone,This is Ralphus. He's powering up. Attempting maximum borkdrive. 13/10 inspirational af https://t.co/YnYAFCTTiK,"https://twitter.com/dog_rates/status/888554962724278272/photo/1,https://twitter.com/dog_rates/status/888554962724278272/photo/1,https://twitter.com/dog_rates/status/888554962724278272/photo/1,https://twitter.com/dog_rates/status/888554962724278272/photo/1",13.0,Ralphus,None,Siberian_husky,3426,19321
888078434458587136,,,2017-07-20 16:49:33 +0000,http://twitter.com/download/iphone,This is Gerald. He was just told he didn't get the job he interviewed for. A h*ckin injustice. 12/10 didn't want the job anyway https://t.co/DK7iDPfuRX,"https://twitter.com/dog_rates/status/888078434458587136/photo/1,https://twitter.com/dog_rates/status/888078434458587136/photo/1",12.0,Gerald,None,French_bulldog,3380,21205
887705289381826560,,,2017-07-19 16:06:48 +0000,http://twitter.com/download/iphone,This is Jeffrey. He has a monopoly on the pool noodles. Currently running a 'boop for two' midweek sale. 13/10 h*ckin strategic https://t.co/PhrUk20Q64,https://twitter.com/dog_rates/status/887705289381826560/photo/1,13.0,Jeffrey,None,basset,5216,29430
887473957103951883,,,2017-07-19 00:47:34 +0000,http://twitter.com/download/iphone,This is Canela. She attempted some fancy porch pics. They were unsuccessful. 13/10 someone help her https://t.co/cLyzpcUcMX,"https://twitter.com/dog_rates/status/887473957103951883/photo/1,https://twitter.com/dog_rates/status/887473957103951883/photo/1",13.0,Canela,None,Pembroke,17591,67189
887343217045368832,,,2017-07-18 16:08:03 +0000,http://twitter.com/download/iphone,You may not have known you needed to see this today. 13/10 please enjoy (IG: emmylouroo) https://t.co/WZqNqygEyV,https://twitter.com/dog_rates/status/887343217045368832/video/1,13.0,None,None,Mexican_hairless,10104,32807
887101392804085760,,,2017-07-18 00:07:08 +0000,http://twitter.com/download/iphone,This... is a Jubilant Antarctic House Bear. We only rate dogs. Please only send dogs. Thank you... 12/10 would suffocate in floof https://t.co/4Ad1jzJSdp,https://twitter.com/dog_rates/status/887101392804085760/photo/1,12.0,None,None,Samoyed,5776,29801
886983233522544640,,,2017-07-17 16:17:36 +0000,http://twitter.com/download/iphone,This is Maya. She's very shy. Rarely leaves her cup. 13/10 would find her an environment to thrive in https://t.co/I6oNy0CgiT,"https://twitter.com/dog_rates/status/886983233522544640/photo/1,https://twitter.com/dog_rates/status/886983233522544640/photo/1",13.0,Maya,None,Chihuahua,7525,34228
886736880519319552,,,2017-07-16 23:58:41 +0000,http://twitter.com/download/iphone,"This is Mingus. He's a wonderful father to his smol pup. Confirmed 13/10, but he needs your help

https://t.co/bVi0Yr4Cff https://t.co/ISvKOSkd5b","https://www.gofundme.com/mingusneedsus,https://twitter.com/dog_rates/status/886736880519319552/photo/1,https://twitter.com/dog_rates/status/886736880519319552/photo/1",13.0,Mingus,None,kuvasz,3167,11737
886366144734445568,,,2017-07-15 23:25:31 +0000,http://twitter.com/download/iphone,This is Roscoe. Another pupper fallen victim to spontaneous tongue ejections. Get the BlepiPen immediate. 12/10 deep breaths Roscoe https://t.co/RGE08MIJox,"https://twitter.com/dog_rates/status/886366144734445568/photo/1,https://twitter.com/dog_rates/status/886366144734445568/photo/1",12.0,Roscoe,pupper,French_bulldog,3100,20643
886258384151887873,,,2017-07-15 16:17:19 +0000,http://twitter.com/download/iphone,This is Waffles. His doggles are pupside down. Unsure how to fix. 13/10 someone assist Waffles https://t.co/xZDA9Qsq1O,https://twitter.com/dog_rates/status/886258384151887873/photo/1,13.0,Waffles,None,pug,6102,27285
885984800019947520,,,2017-07-14 22:10:11 +0000,http://twitter.com/download/iphone,Viewer discretion advised. This is Jimbo. He will rip ur finger right h*ckin off. Other dog clearly an accessory. 12/10 pls pet with caution https://t.co/BuveP0uMF1,https://twitter.com/dog_rates/status/885984800019947520/photo/1,12.0,Jimbo,None,Blenheim_spaniel,6561,31788
885528943205470208,,,2017-07-13 15:58:47 +0000,http://twitter.com/download/iphone,This is Maisey. She fell asleep mid-excavation. Happens to the best of us. 13/10 would pat noggin approvingly https://t.co/tp1kQ8i9JF,https://twitter.com/dog_rates/status/885528943205470208/photo/1,13.0,Maisey,None,pug,6229,35053
885311592912609280,,,2017-07-13 01:35:06 +0000,http://twitter.com/download/iphone,RT @dog_rates: This is Lilly. She just parallel barked. Kindly requests a reward now. 13/10 would pet so well https://t.co/SATN4If5H5,"https://twitter.com/dog_rates/status/830583320585068544/photo/1,https://twitter.com/dog_rates/status/830583320585068544/photo/1,https://twitter.com/dog_rates/status/830583320585068544/photo/1,https://twitter.com/dog_rates/status/830583320585068544/photo/1",13.0,Lilly,None,Labrador_retriever,17976,0
885167619883638784,,,2017-07-12 16:03:00 +0000,http://twitter.com/download/iphone,Here we have a corgi undercover as a malamute. Pawbably doing important investigative work. Zero control over tongue happenings. 13/10 https://t.co/44ItaMubBf,"https://twitter.com/dog_rates/status/885167619883638784/photo/1,https://twitter.com/dog_rates/status/885167619883638784/photo/1,https://twitter.com/dog_rates/status/885167619883638784/photo/1,https://twitter.com/dog_rates/status/885167619883638784/photo/1",13.0,None,None,malamute,4251,21358
884925521741709313,,,2017-07-12 00:01:00 +0000,http://twitter.com/download/iphone,"This is Earl. He found a hat. Nervous about what you think of it. 12/10 it's delightful, Earl https://t.co/MYJvdlNRVa",https://twitter.com/dog_rates/status/884925521741709313/photo/1,12.0,Earl,None,Italian_greyhound,17692,75374
884876753390489601,,,2017-07-11 20:47:12 +0000,http://twitter.com/download/iphone,This is Lola. It's her first time outside. Must test the earth and taste the atmosphere. 13/10 you're doing great Lola https://t.co/74TKAUsLkO,"https://twitter.com/dog_rates/status/884876753390489601/photo/1,https://twitter.com/dog_rates/status/884876753390489601/photo/1,https://twitter.com/dog_rates/status/884876753390489601/photo/1,https://twitter.com/dog_rates/status/884876753390489601/photo/1",13.0,Lola,None,chow,5448,27195
884562892145688576,,,2017-07-11 00:00:02 +0000,http://twitter.com/download/iphone,This is Kevin. He's just so happy. 13/10 what is your secret Kevin https://t.co/1r4MFCbCX5,https://twitter.com/dog_rates/status/884562892145688576/photo/1,13.0,Kevin,None,pug,4545,23663
884441805382717440,,,2017-07-10 15:58:53 +0000,http://twitter.com/download/iphone,"I present to you, Pup in Hat. Pup in Hat is great for all occasions. Extremely versatile. Compact as h*ck. 14/10 (IG: itselizabethgales) https://t.co/vvBOcC2VdC",https://twitter.com/dog_rates/status/884441805382717440/photo/1,14.0,None,None,Pembroke,5490,26324
884162670584377345,,,2017-07-09 21:29:42 +0000,http://twitter.com/download/iphone,Meet Yogi. He doesn't have any important dog meetings today he just enjoys looking his best at all times. 12/10 for dangerously dapper doggo https://t.co/YSI00BzTBZ,https://twitter.com/dog_rates/status/884162670584377345/photo/1,12.0,Yogi,doggo,German_shepherd,2890,19835
883838122936631299,,,2017-07-09 00:00:04 +0000,http://twitter.com/download/iphone,This is Noah. He can't believe someone made this mess. Got the vacuum out for you though. Offered to help clean pup. 12/10 super good boy https://t.co/V85xujjDDY,https://twitter.com/dog_rates/status/883838122936631299/photo/1,12.0,Noah,None,Doberman,3342,21335
883482846933004288,,,2017-07-08 00:28:19 +0000,http://twitter.com/download/iphone,"This is Bella. She hopes her smile made you smile. If not, she is also offering you her favorite monkey. 13.5/10 https://t.co/qjrljjt948","https://twitter.com/dog_rates/status/883482846933004288/photo/1,https://twitter.com/dog_rates/status/883482846933004288/photo/1",5.0,Bella,None,golden_retriever,9632,44738
883360690899218434,,,2017-07-07 16:22:55 +0000,http://twitter.com/download/iphone,Meet Grizzwald. He may be the floofiest floofer I ever did see. Lost eyes saving a schoolbus from a volcano erpuption. 13/10 heroic as h*ck https://t.co/rf661IFEYP,https://twitter.com/dog_rates/status/883360690899218434/photo/1,13.0,Grizzwald,floofer,chow,3595,22118
883117836046086144,,,2017-07-07 00:17:54 +0000,http://twitter.com/download/iphone,"Please only send dogs. We don't rate mechanics, no matter how h*ckin good. Thank you... 13/10 would sneak a pat https://t.co/Se5fZ9wp5E","https://twitter.com/dog_rates/status/883117836046086144/photo/1,https://twitter.com/dog_rates/status/883117836046086144/photo/1",13.0,None,None,golden_retriever,6464,36214
882992080364220416,,,2017-07-06 15:58:11 +0000,http://twitter.com/download/iphone,This is Rusty. He wasn't ready for the first pic. Clearly puppared for the second. 13/10 confirmed great boy https://t.co/tyER0KpdXj,"https://twitter.com/dog_rates/status/882992080364220416/photo/1,https://twitter.com/dog_rates/status/882992080364220416/photo/1",13.0,Rusty,None,Eskimo_dog,3806,23332
882762694511734784,,,2017-07-06 00:46:41 +0000,http://twitter.com/download/iphone,This is Gus. He's quite the cheeky pupper. Already perfected the disinterested wink. 12/10 would let steal my girl https://t.co/D43I96SlVu,https://twitter.com/dog_rates/status/882762694511734784/photo/1,12.0,Gus,pupper,Labrador_retriever,4753,27581
882627270321602560,,,2017-07-05 15:48:34 +0000,http://twitter.com/download/iphone,This is Stanley. He has his first swim lesson today. Doggle straps adjusted. Ready to go. 13/10 Phelps is nervous (IG: stanleythe_corgi) https://t.co/Nx52PGwH94,https://twitter.com/dog_rates/status/882627270321602560/photo/1,13.0,Stanley,None,Pembroke,5910,27228
882268110199369728,,,2017-07-04 16:01:23 +0000,http://twitter.com/download/iphone,This is Alfy. You're witnessing his first watermelon experience. I think it was a success. 13/10 happy 4th Alfy ðŸ‡ºðŸ‡¸ https://t.co/fYP5RlutfA,"https://twitter.com/dog_rates/status/882268110199369728/photo/1,https://twitter.com/dog_rates/status/882268110199369728/photo/1,https://twitter.com/dog_rates/status/882268110199369728/photo/1",13.0,Alfy,None,golden_retriever,11244,43790
881906580714921986,,,2017-07-03 16:04:48 +0000,http://twitter.com/download/iphone,This is Rey. He's a Benebop Cumberfloof. 12/10 dangerously pettable https://t.co/503CgWbhxQ,https://twitter.com/dog_rates/status/881906580714921986/photo/1,12.0,Rey,None,Weimaraner,3297,23705
881666595344535552,,,2017-07-03 00:11:11 +0000,http://twitter.com/download/iphone,This is Gary. He couldn't miss this puppertunity for a selfie. Flawless focusing skills. 13/10 would boop intensely https://t.co/7CSWCl8I6s,https://twitter.com/dog_rates/status/881666595344535552/photo/1,13.0,Gary,None,Saluki,10365,49321
881536004380872706,,,2017-07-02 15:32:16 +0000,http://twitter.com/download/iphone,"Here is a pupper approaching maximum borkdrive. Zooming at never before seen speeds. 14/10 paw-inspiring af 
(IG: puffie_the_chow) https://t.co/ghXBIIeQZF",https://twitter.com/dog_rates/status/881536004380872706/video/1,14.0,None,pupper,Samoyed,15494,48180
880872448815771648,,,2017-06-30 19:35:32 +0000,http://twitter.com/download/iphone,Ugh not again. We only rate dogs. Please don't send in well-dressed  floppy-tongued street penguins. Dogs only please. Thank you... 12/10 https://t.co/WiAMbTkDPf,https://twitter.com/dog_rates/status/880872448815771648/photo/1,12.0,None,None,Pembroke,3715,20725
880465832366813184,,,2017-06-29 16:39:47 +0000,http://twitter.com/download/iphone,This is Bella. She had her first beach experience this morning. Complete success. 12/10 would perform a sandy boop https://t.co/4VsFysDmiw,"https://twitter.com/dog_rates/status/880465832366813184/photo/1,https://twitter.com/dog_rates/status/880465832366813184/photo/1,https://twitter.com/dog_rates/status/880465832366813184/photo/1,https://twitter.com/dog_rates/status/880465832366813184/photo/1",12.0,Bella,None,golden_retriever,6099,27813
880221127280381952,,,2017-06-29 00:27:25 +0000,http://twitter.com/download/iphone,Meet Jesse. He's a Fetty Woof. His tongue ejects without warning. A true bleptomaniac. 12/10 would snug well https://t.co/fUod0tVmvK,"https://twitter.com/dog_rates/status/880221127280381952/photo/1,https://twitter.com/dog_rates/status/880221127280381952/photo/1",12.0,Jesse,None,Chihuahua,4094,26350
880095782870896641,,,2017-06-28 16:09:20 +0000,http://twitter.com/download/iphone,Please don't send in photos without dogs in them. We're not @porch_rates. Insubordinate and churlish. Pretty good porch tho 11/10 https://t.co/HauE8M3Bu4,https://twitter.com/dog_rates/status/880095782870896641/photo/1,11.0,None,None,miniature_pinscher,4214,26924
879862464715927552,,,2017-06-28 00:42:13 +0000,http://twitter.com/download/iphone,This is Romeo. He would like to do an entrance. Requesting your immediate assistance. 13/10 https://t.co/Qh5aEkRQm9,"https://twitter.com/dog_rates/status/879862464715927552/photo/1,https://twitter.com/dog_rates/status/879862464715927552/photo/1,https://twitter.com/dog_rates/status/879862464715927552/photo/1",13.0,Romeo,None,basset,3395,21792
879492040517615616,,,2017-06-27 00:10:17 +0000,http://twitter.com/download/iphone,This is Bailey. He thinks you should measure ear length for signs of growth instead. 12/10 https://t.co/IxM9IMKQq8,https://twitter.com/dog_rates/status/879492040517615616/photo/1,12.0,Bailey,None,German_short-haired_pointer,3090,22855
879415818425184262,,,2017-06-26 19:07:24 +0000,http://twitter.com/download/iphone,This is Duddles. He did an attempt. 13/10 someone help him (vid by Georgia Felici) https://t.co/UDT7ZkcTgY,https://twitter.com/dog_rates/status/879415818425184262/video/1,13.0,Duddles,None,English_springer,43053,103179
879008229531029506,,,2017-06-25 16:07:47 +0000,http://twitter.com/download/iphone,This is Beau. That is Beau's balloon. He takes it everywhere. 13/10 would protect at all costs https://t.co/YDtpCjIPKN,https://twitter.com/dog_rates/status/879008229531029506/photo/1,13.0,Beau,None,vizsla,2617,18516
878776093423087618,,,2017-06-25 00:45:22 +0000,http://twitter.com/download/iphone,This is Snoopy. He's a proud #PrideMonthPuppo. Impeccable handwriting for not having thumbs. 13/10 would love back #PrideMonth https://t.co/lNZwgNO4gS,"https://twitter.com/dog_rates/status/878776093423087618/photo/1,https://twitter.com/dog_rates/status/878776093423087618/photo/1",13.0,Snoopy,puppo,Italian_greyhound,4010,18947
877736472329191424,,,2017-06-22 03:54:17 +0000,http://twitter.com/download/iphone,This is Aja. She was just told she's a good dog. Suspicions confirmed. 13/10 would tell again https://t.co/lsPyyAiF1r,"https://twitter.com/dog_rates/status/877736472329191424/photo/1,https://twitter.com/dog_rates/status/877736472329191424/photo/1",13.0,Aja,None,Chesapeake_Bay_retriever,18570,77762
877611172832227328,,,2017-06-21 19:36:23 +0000,http://twitter.com/download/iphone,RT @rachel2195: @dog_rates the boyfriend and his soaking wet pupper h*cking love his new hat 14/10 https://t.co/dJx4Gzc50G,"https://twitter.com/rachel2195/status/876850772322988033/photo/1,https://twitter.com/rachel2195/status/876850772322988033/photo/1,https://twitter.com/rachel2195/status/876850772322988033/photo/1,https://twitter.com/rachel2195/status/876850772322988033/photo/1",14.0,None,pupper,Irish_setter,78,0
877556246731214848,,,2017-06-21 15:58:08 +0000,http://twitter.com/download/iphone,This is Penny. She's both pupset and fired pup. Not pleased w your barbaric attempts at cleanliness. 12/10 would enjoy more shampoo options https://t.co/OYdDlfOGXP,https://twitter.com/dog_rates/status/877556246731214848/photo/1,12.0,Penny,None,basset,3698,22183
877316821321428993,,,2017-06-21 00:06:44 +0000,http://twitter.com/download/iphone,"Meet Dante. At first he wasn't a fan of his new raincoat, then he saw his reflection. H*ckin handsome. 13/10 for water resistant good boy https://t.co/SHRTIo5pxc","https://twitter.com/dog_rates/status/877316821321428993/photo/1,https://twitter.com/dog_rates/status/877316821321428993/photo/1",13.0,Dante,None,Saluki,5051,26733
877201837425926144,,,2017-06-20 16:29:50 +0000,http://twitter.com/download/iphone,This is Nelly. He graduated with his dogtorate today. Wants to know if you're proud of him. 12/10 would give congratulatory boop https://t.co/4g4cfj3P4Y,"https://twitter.com/dog_rates/status/877201837425926144/photo/1,https://twitter.com/dog_rates/status/877201837425926144/photo/1",12.0,Nelly,None,Pembroke,5434,26472
876838120628539392,,,2017-06-19 16:24:33 +0000,http://twitter.com/download/iphone,This is Ginger. She's having a ruff Monday. Too many pupper things going on. H*ckin exhausting. 12/10 would snug passionately https://t.co/j211oCDRs6,"https://twitter.com/dog_rates/status/876838120628539392/photo/1,https://twitter.com/dog_rates/status/876838120628539392/photo/1",12.0,Ginger,pupper,bloodhound,3252,20191
876484053909872640,,,2017-06-18 16:57:37 +0000,http://twitter.com/download/iphone,This is Benedict. He wants to thank you for this delightful urban walk. Hopes you know he loves you. 13/10 super duper good boy https://t.co/26BXueUgbs,https://twitter.com/dog_rates/status/876484053909872640/photo/1,13.0,Benedict,None,golden_retriever,2329,18314
876120275196170240,,,2017-06-17 16:52:05 +0000,http://twitter.com/download/iphone,"Meet Venti, a seemingly caffeinated puppoccino. She was just informed the weekend would include walks, pats and scritches. 13/10 much excite https://t.co/ejExJFq3ek",https://twitter.com/dog_rates/status/876120275196170240/photo/1,13.0,Venti,None,Bernese_mountain_dog,4562,27285
875747767867523072,,,2017-06-16 16:11:53 +0000,http://twitter.com/download/iphone,"This is Goose. He's a womanizer. Cheeky as h*ck, but also deep. Tongue slip game on another level. 13/10 will steal your girl https://t.co/V2WlACRJCN",https://twitter.com/dog_rates/status/875747767867523072/photo/1,13.0,Goose,None,Labrador_retriever,4181,24606
875144289856114688,,,2017-06-15 00:13:52 +0000,http://twitter.com/download/iphone,Meet Nugget and Hank. Nugget took Hank's bone. Hank is wondering if you would please return it to him. Both 13/10 would not intervene https://t.co/ogith9ejNj,https://twitter.com/dog_rates/status/875144289856114688/video/1,13.0,Nugget,None,Siberian_husky,4816,21437
875021211251597312,,,2017-06-14 16:04:48 +0000,http://twitter.com/download/iphone,Guys please stop sending pictures without any dogs in th- oh never mind hello excuse me sir. 12/10 stealthy as h*ck https://t.co/brCQoqc8AW,"https://twitter.com/dog_rates/status/875021211251597312/photo/1,https://twitter.com/dog_rates/status/875021211251597312/photo/1",12.0,None,None,West_Highland_white_terrier,4608,24895
874680097055178752,,,2017-06-13 17:29:20 +0000,http://twitter.com/download/iphone,Meet Cash. He hath acquired a stick. A very good stick tbh. 12/10 would pat head approvingly https://t.co/lZhtizkURD,https://twitter.com/dog_rates/status/874680097055178752/photo/1,12.0,Cash,None,Labrador_retriever,4533,27198
874296783580663808,,,2017-06-12 16:06:11 +0000,http://twitter.com/download/iphone,This is Jed. He may be the fanciest pupper in the game right now. Knows it too. 13/10 would sign modeling contract https://t.co/0YplNnSMEm,https://twitter.com/dog_rates/status/874296783580663808/photo/1,13.0,Jed,pupper,cocker_spaniel,4014,25475
874057562936811520,,,2017-06-12 00:15:36 +0000,http://twitter.com/download/iphone,"I can't believe this keeps happening. This, is a birb taking a bath. We only rate dogs. Please only send dogs. Thank you... 12/10 https://t.co/pwY9PQhtP2",https://twitter.com/dog_rates/status/874057562936811520/photo/1,12.0,None,None,flat-coated_retriever,3863,22196
