tweet_id,in_reply_to_status_id,in_reply_to_user_id,timestamp,source,text,expanded_urls,rating_numerator,name,dog_stage,dog_breed,retweet_count,favorite_count
719332531645071360,,,2016-04-11 01:13:34 +0000,http://twitter.com/download/iphone,This is Pippa. She managed to start the car but is waiting for you to buckle up before driving. Responsible af 11/10 https://t.co/htrlmC7saz,https://twitter.com/dog_rates/status/719332531645071360/photo/1,11.0,Pippa,None,Dandie_Dinmont,1002,3534
718971898235854848,,,2016-04-10 01:20:33 +0000,http://twitter.com/download/iphone,This is Sadie. She is prepared for battle. 10/10 https://t.co/JRckDkZVRT,https://twitter.com/dog_rates/status/718971898235854848/photo/1,10.0,Sadie,None,golden_retriever,1151,3606
718939241951195136,,,2016-04-09 23:10:47 +0000,http://twitter.com/download/iphone,This is Otis. Everybody look at Otis. 12/10 would probably faint while petting https://t.co/I9qoe1uEih,https://twitter.com/dog_rates/status/718939241951195136/photo/1,12.0,Otis,None,Pembroke,1851,5414
718613305783398402,,,2016-04-09 01:35:37 +0000,http://twitter.com/download/iphone,This is Carper. He's a Tortellini Angiosperm. In desperate need of a petting. 11/10 would hug softly https://t.co/lK9YDkRzPj,https://twitter.com/dog_rates/status/718613305783398402/photo/1,11.0,Carper,None,Labrador_retriever,505,2518
718540630683709445,,,2016-04-08 20:46:50 +0000,http://twitter.com/download/iphone,Get you a pup that can do both. 10/10 https://t.co/zSbyvm62xZ,"https://twitter.com/dog_rates/status/718540630683709445/photo/1,https://twitter.com/dog_rates/status/718540630683709445/photo/1",10.0,None,None,Maltese_dog,1065,2558
718246886998687744,,,2016-04-08 01:19:36 +0000,http://twitter.com/download/iphone,This is Alexanderson. He's got a weird ass birth mark. Dreadful at fetch. Won't eat kibble. 3/10 wtf @Target https://t.co/FmxOpf2Sgl,https://twitter.com/dog_rates/status/718246886998687744/photo/1,3.0,Alexanderson,None,Chihuahua,524,1996
718234618122661888,,,2016-04-08 00:30:51 +0000,http://twitter.com/download/iphone,This is Suki. She was born with a blurry tail (unfortunate). Next level tongue tho. 11/10 nifty hardwood https://t.co/05S8oYztgb,https://twitter.com/dog_rates/status/718234618122661888/photo/1,11.0,Suki,None,malamute,1057,4007
717841801130979328,,,2016-04-06 22:29:56 +0000,http://twitter.com/download/iphone,This is Barclay. His father was a banana. 11/10 appeeling af https://t.co/ucOEfr2rjV,https://twitter.com/dog_rates/status/717841801130979328/photo/1,11.0,Barclay,None,Brittany_spaniel,621,2534
717537687239008257,,,2016-04-06 02:21:30 +0000,http://twitter.com/download/iphone,People please. This is a Deadly Mediterranean Plop T-Rex. We only rate dogs. Only send in dogs. Thanks you... 11/10 https://t.co/2ATDsgHD4n,https://twitter.com/dog_rates/status/717537687239008257/photo/1,11.0,None,None,golden_retriever,1931,5942
717421804990701568,,,2016-04-05 18:41:02 +0000,http://twitter.com/download/iphone,This is Ebby. She's a Zimbabwean Feta. Embarrassed by ridiculously squishy face. 9/10 would squeeze softly https://t.co/LBJqxMGaHi,"https://twitter.com/dog_rates/status/717421804990701568/photo/1,https://twitter.com/dog_rates/status/717421804990701568/photo/1",9.0,Ebby,None,miniature_pinscher,881,3257
717047459982213120,,,2016-04-04 17:53:31 +0000,http://twitter.com/download/iphone,This is FlÃ¡vio (pronounced Baxter). He's a Benesnoop Cumberdog. Super rare. Symmetrical. 12/10 would pet so well https://t.co/fGgleFiBPq,https://twitter.com/dog_rates/status/717047459982213120/photo/1,12.0,FlÃ¡vio,None,golden_retriever,2012,6484
717009362452090881,,,2016-04-04 15:22:08 +0000,http://twitter.com/download/iphone,This is Smokey. He's having some sort of existential crisis. 10/10 hang in there pupper https://t.co/JmgF4dMpw0,https://twitter.com/dog_rates/status/717009362452090881/photo/1,10.0,Smokey,pupper,Siberian_husky,1023,3378
716802964044845056,,,2016-04-04 01:41:58 +0000,http://twitter.com/download/iphone,This is Link. He struggles with couches. 10/10 would assist https://t.co/SbX4e6Yg3o,"https://twitter.com/dog_rates/status/716802964044845056/photo/1,https://twitter.com/dog_rates/status/716802964044845056/photo/1",10.0,Link,None,malinois,1241,4431
716791146589110272,,,2016-04-04 00:55:01 +0000,http://twitter.com/download/iphone,Meet Jennifur. She's supposed to be navigating. Not even buckled up. Insubordinate &amp; churlish. 11/10 would still pet https://t.co/h0trcJohYO,https://twitter.com/dog_rates/status/716791146589110272/photo/1,11.0,Jennifur,None,Pomeranian,1509,6196
716285507865542656,,,2016-04-02 15:25:47 +0000,http://twitter.com/download/iphone,This is Stephanus. She stays woke. 12/10 https://t.co/WIWabMngQZ,"https://twitter.com/dog_rates/status/716285507865542656/photo/1,https://twitter.com/dog_rates/status/716285507865542656/photo/1",12.0,Stephanus,None,Yorkshire_terrier,1138,2877
716080869887381504,,,2016-04-02 01:52:38 +0000,http://twitter.com/download/iphone,Here's a super majestic doggo and a sunset 11/10 https://t.co/UACnoyi8zu,"https://twitter.com/dog_rates/status/716080869887381504/photo/1,https://twitter.com/dog_rates/status/716080869887381504/photo/1",11.0,None,doggo,golden_retriever,2016,6961
715928423106027520,,,2016-04-01 15:46:52 +0000,http://twitter.com/download/iphone,This is Bubbles. He's a Yorkshire Piccolope. 11/10 would snug aggressively https://t.co/3BhMojONxq,https://twitter.com/dog_rates/status/715928423106027520/photo/1,11.0,Bubbles,None,pug,919,3297
715733265223708672,,,2016-04-01 02:51:22 +0000,http://twitter.com/download/iphone,This is a taco. We only rate dogs. Please only send in dogs. Dogs are what we rate. Not tacos. Thank you... 10/10 https://t.co/cxl6xGY8B9,https://twitter.com/dog_rates/status/715733265223708672/photo/1,10.0,None,None,Dandie_Dinmont,1770,4833
715696743237730304,,,2016-04-01 00:26:15 +0000,http://twitter.com/download/iphone,Meet Toby. He's a Lithuanian High-Steppin Stickeroo. One of the more accomplished Stickeroos around. 10/10 so nifty https://t.co/cYPHuJYTjC,https://twitter.com/dog_rates/status/715696743237730304/photo/1,10.0,Toby,None,Staffordshire_bullterrier,1353,4034
715680795826982913,,,2016-03-31 23:22:53 +0000,http://twitter.com/download/iphone,This is Zeus. He's downright fabulous. 12/10 https://t.co/sSugyyRuTp,"https://twitter.com/dog_rates/status/715680795826982913/photo/1,https://twitter.com/dog_rates/status/715680795826982913/photo/1,https://twitter.com/dog_rates/status/715680795826982913/photo/1",12.0,Zeus,None,golden_retriever,1704,4479
715342466308784130,,,2016-03-31 00:58:29 +0000,http://twitter.com/download/iphone,This is Oscar. He's a world renowned snowball inspector. It's a ruff job but someone has to do it. 10/10 great guy https://t.co/vSufMAKm3C,"https://twitter.com/dog_rates/status/715342466308784130/photo/1,https://twitter.com/dog_rates/status/715342466308784130/photo/1",10.0,Oscar,None,West_Highland_white_terrier,719,3136
715220193576927233,,,2016-03-30 16:52:36 +0000,http://twitter.com/download/iphone,This is Nico. His selfie game is strong af. Excellent use of a sneaky tongue slip. 10/10 star material https://t.co/1OBdJkMOFx,https://twitter.com/dog_rates/status/715220193576927233/photo/1,10.0,Nico,None,Chihuahua,687,2504
715200624753819648,,,2016-03-30 15:34:51 +0000,http://twitter.com/download/iphone,This is Michelangelope. He's half coffee cup. Rare af. 12/10 would hug until someone stopped me https://t.co/tvVDY0G911,https://twitter.com/dog_rates/status/715200624753819648/photo/1,12.0,Michelangelope,None,Chihuahua,1982,5303
714982300363173890,,,2016-03-30 01:07:18 +0000,http://twitter.com/download/iphone,This is Calbert. He forgot to clear his Google search history. 9/10 rookie mistake Calbert https://t.co/jRm5J3YCmj,https://twitter.com/dog_rates/status/714982300363173890/photo/1,9.0,Calbert,None,Brittany_spaniel,1082,3883
714957620017307648,,,2016-03-29 23:29:14 +0000,http://twitter.com/download/iphone,This is Curtis. He's an Albino Haberdasher. Terrified of dandelions. They really spook him up. 10/10 it'll be ok pup https://t.co/s8YcfZrWhK,https://twitter.com/dog_rates/status/714957620017307648/photo/1,10.0,Curtis,None,Great_Pyrenees,1489,4275
714606013974974464,,,2016-03-29 00:12:05 +0000,http://twitter.com/download/iphone,Here are two lil cuddly puppers. Both 12/10 would snug like so much https://t.co/zO4eb7C4tG,https://twitter.com/dog_rates/status/714606013974974464/photo/1,12.0,None,None,Norfolk_terrier,971,3756
714258258790387713,,,2016-03-28 01:10:13 +0000,http://twitter.com/download/iphone,"Meet Travis and Flurp. Travis is pretty chill but Flurp can't lie down properly. 10/10 &amp; 8/10
get it together Flurp https://t.co/Akzl5ynMmE",https://twitter.com/dog_rates/status/714258258790387713/photo/1,10.0,Travis,None,collie,753,3131
714251586676113411,,,2016-03-28 00:43:43 +0000,http://twitter.com/download/iphone,This is Thumas. He hates potted plants. 8/10 wtf Thumas https://t.co/rDVueNIcEi,"https://twitter.com/dog_rates/status/714251586676113411/photo/1,https://twitter.com/dog_rates/status/714251586676113411/photo/1",8.0,Thumas,None,soft-coated_wheaten_terrier,880,3383
714214115368108032,,,2016-03-27 22:14:49 +0000,http://twitter.com/download/iphone,Happy Easter from the squad! ðŸ‡ðŸ¶ 13/10 for all https://t.co/YMx4KWJUAB,https://twitter.com/dog_rates/status/714214115368108032/photo/1,13.0,None,None,pug,922,2353
714141408463036416,,,2016-03-27 17:25:54 +0000,http://twitter.com/download/iphone,"I know we only rate dogs, but since it's Easter I guess we could rate a bunny for a change. 10/10 petable as hell https://t.co/O2RlKXigHu",https://twitter.com/dog_rates/status/714141408463036416/photo/1,10.0,None,None,Labrador_retriever,1477,4463
713919462244790272,,,2016-03-27 02:43:58 +0000,http://twitter.com/download/iphone,This is Kanu. He's a Freckled Ticonderoga. Simply flawless. 12/10 would perform an elaborate heist to capture https://t.co/7vyAzIURrE,https://twitter.com/dog_rates/status/713919462244790272/photo/1,12.0,Kanu,None,Siberian_husky,815,3393
713761197720473600,,,2016-03-26 16:15:05 +0000,http://twitter.com/download/iphone,This is Piper. She would really like that tennis ball core. Super sneaky tongue slip. 12/10 precious af https://t.co/QP6GHi5az9,"https://twitter.com/dog_rates/status/713761197720473600/photo/1,https://twitter.com/dog_rates/status/713761197720473600/photo/1",12.0,Piper,None,Brittany_spaniel,1447,5055
713411074226274305,,,2016-03-25 17:03:49 +0000,http://twitter.com/download/iphone,Here we see an extremely rare Bearded Floofmallow. Only a few left in the wild. 11/10 would pet with a purpose https://t.co/jVJJKlPbvq,https://twitter.com/dog_rates/status/713411074226274305/photo/1,11.0,None,None,Great_Pyrenees,1361,4573
713177543487135744,,,2016-03-25 01:35:51 +0000,http://twitter.com/download/iphone,This is Lance. Lance doesn't give a shit. 10/10 we should all be more like Lance https://t.co/SqnG9Ap28J,https://twitter.com/dog_rates/status/713177543487135744/photo/1,10.0,Lance,None,whippet,2968,7464
712717840512598017,,,2016-03-23 19:09:09 +0000,http://twitter.com/download/iphone,Please don't send in any more polar bears. We only rate dogs. Thank you... 10/10 https://t.co/83RGhdIQz2,https://twitter.com/dog_rates/status/712717840512598017/photo/1,10.0,None,None,Great_Pyrenees,5259,12789
712668654853337088,,,2016-03-23 15:53:42 +0000,http://twitter.com/download/iphone,Say hello to Sunny and Roxy. They pull things out of water together. 10/10 for both https://t.co/88aedAmxcl,"https://twitter.com/dog_rates/status/712668654853337088/photo/1,https://twitter.com/dog_rates/status/712668654853337088/photo/1,https://twitter.com/dog_rates/status/712668654853337088/photo/1",10.0,Sunny,None,Labrador_retriever,1278,4305
712097430750289920,,,2016-03-22 02:03:52 +0000,http://twitter.com/download/iphone,I can't even comprehend how confused this dog must be right now. 10/10 https://t.co/8AGcQ4hIfK,https://twitter.com/dog_rates/status/712097430750289920/photo/1,10.0,None,None,Labrador_retriever,1090,3930
712085617388212225,,,2016-03-22 01:16:55 +0000,http://twitter.com/download/iphone,"Say hello to Olive and Ruby. They are best buddies. Both 11/10 
1 like = 1 buddy https://t.co/yagmFdKlyL","https://twitter.com/dog_rates/status/712085617388212225/photo/1,https://twitter.com/dog_rates/status/712085617388212225/photo/1,https://twitter.com/dog_rates/status/712085617388212225/photo/1",11.0,Olive,None,Shih-Tzu,509,3368
711743778164514816,,,2016-03-21 02:38:34 +0000,http://twitter.com/download/iphone,Meet Roosevelt. He's calculating the best case scenario if he drops out instead of doing math hw. 11/10 relatable af https://t.co/QcSIRDpfVg,https://twitter.com/dog_rates/status/711743778164514816/photo/1,11.0,Roosevelt,None,Lakeland_terrier,1033,2942
711363825979756544,,,2016-03-20 01:28:47 +0000,http://twitter.com/download/iphone,"""Please, no puparazzi"" 11/10 https://t.co/nJIXSPfedK","https://twitter.com/dog_rates/status/711363825979756544/photo/1,https://twitter.com/dog_rates/status/711363825979756544/photo/1",11.0,None,None,Pembroke,1190,3795
711008018775851008,,,2016-03-19 01:54:56 +0000,http://twitter.com/download/iphone,This is Chuckles. He had a balloon but he accidentally let go of it and it floated away. 11/10 hang in there pupper https://t.co/68iNM7B5gW,https://twitter.com/dog_rates/status/711008018775851008/photo/1,11.0,Chuckles,pupper,French_bulldog,646,3102
710997087345876993,,,2016-03-19 01:11:29 +0000,http://twitter.com/download/iphone,Meet Milo and Amos. They are the best of pals. Both 12/10 would pet at the same time https://t.co/Mv37BHEyyD,https://twitter.com/dog_rates/status/710997087345876993/photo/1,12.0,Milo,None,malamute,1460,4718
710833117892898816,,,2016-03-18 14:19:56 +0000,http://twitter.com/download/iphone,Say hello to Sora. She's an Egyptian Pumpernickel. Mesmerizing af. 12/10 would bring home to mom https://t.co/PmTR4kxZkq,https://twitter.com/dog_rates/status/710833117892898816/photo/1,12.0,Sora,None,Pembroke,563,2790
710588934686908417,,,2016-03-17 22:09:38 +0000,http://twitter.com/download/iphone,This is Beemo. He's a Chubberflop mix. 12/10 would cross the world for https://t.co/kzMVMU8HBV,"https://twitter.com/dog_rates/status/710588934686908417/photo/1,https://twitter.com/dog_rates/status/710588934686908417/photo/1,https://twitter.com/dog_rates/status/710588934686908417/photo/1,https://twitter.com/dog_rates/status/710588934686908417/photo/1",12.0,Beemo,None,Pembroke,1969,4709
710283270106132480,,,2016-03-17 01:55:02 +0000,http://twitter.com/download/iphone,This is Gunner. He's a Figamus Newton. King of the peek-a-boo. Cool jeans. 11/10 https://t.co/ONuBILIYXZ,"https://twitter.com/dog_rates/status/710283270106132480/photo/1,https://twitter.com/dog_rates/status/710283270106132480/photo/1",11.0,Gunner,None,Shih-Tzu,542,2219
710272297844797440,,,2016-03-17 01:11:26 +0000,http://twitter.com/download/iphone,We ðŸ‘ðŸ» only ðŸ‘ðŸ» rate ðŸ‘ðŸ» dogs. Pls stop sending in non-canines like this Dutch Panda Worm. This is infuriating. 11/10 https://t.co/odfLzBonG2,https://twitter.com/dog_rates/status/710272297844797440/photo/1,11.0,infuriating,None,Old_English_sheepdog,1318,4705
710269109699739648,,,2016-03-17 00:58:46 +0000,http://twitter.com/download/iphone,"The squad is back for St. Patrick's Day! â˜˜ ðŸ’š
13/10 for all https://t.co/OcCDb2bng5",https://twitter.com/dog_rates/status/710269109699739648/photo/1,13.0,None,None,pug,1183,2489
710140971284037632,,,2016-03-16 16:29:35 +0000,http://twitter.com/download/iphone,This is Tater. His underbite is fierce af. Doesn't give a damn about your engagement photo. 8/10 https://t.co/nLuPY3pY12,https://twitter.com/dog_rates/status/710140971284037632/photo/1,8.0,Tater,None,Pekinese,933,2865
710117014656950272,,,2016-03-16 14:54:24 +0000,http://twitter.com/download/iphone,This pupper got her hair chalked for her birthday. Hasn't told her parents yet. Rebellious af. 11/10 very nifty https://t.co/h1OX2mLtxV,"https://twitter.com/dog_rates/status/710117014656950272/photo/1,https://twitter.com/dog_rates/status/710117014656950272/photo/1",11.0,None,pupper,toy_poodle,2098,5694
709918798883774466,,,2016-03-16 01:46:45 +0000,http://twitter.com/download/iphone,Meet Watson. He's a Suzuki Tickleboop. Leader of a notorious biker gang. Only one ear functional. 12/10 snuggable af https://t.co/R1gLc5vDqG,"https://twitter.com/dog_rates/status/709918798883774466/photo/1,https://twitter.com/dog_rates/status/709918798883774466/photo/1",12.0,Watson,None,Pembroke,1120,3097
709852847387627521,,,2016-03-15 21:24:41 +0000,http://twitter.com/download/iphone,*lets out a tiny whimper and then collapses* ...12/10 https://t.co/BNdVZEHRow,"https://twitter.com/dog_rates/status/709852847387627521/photo/1,https://twitter.com/dog_rates/status/709852847387627521/photo/1,https://twitter.com/dog_rates/status/709852847387627521/photo/1,https://twitter.com/dog_rates/status/709852847387627521/photo/1",12.0,None,None,Chihuahua,1258,3639
709566166965075968,,,2016-03-15 02:25:31 +0000,http://twitter.com/download/iphone,This is Olaf. He's gotta be rare. Seems sturdy. Tail is floofy af. 12/10 would do whatever it takes to pet https://t.co/E9jaU59bh9,https://twitter.com/dog_rates/status/709566166965075968/photo/1,12.0,Olaf,None,chow,1267,3668
709556954897764353,,,2016-03-15 01:48:55 +0000,http://twitter.com/download/iphone,This is Cecil. She's a Gigglefloof Poofer. Outdoorsy af. One with nature. 12/10 would strategically capture https://t.co/ijJB0DuOIC,"https://twitter.com/dog_rates/status/709556954897764353/photo/1,https://twitter.com/dog_rates/status/709556954897764353/photo/1,https://twitter.com/dog_rates/status/709556954897764353/photo/1",12.0,Cecil,None,golden_retriever,1116,3411
709519240576036864,,,2016-03-14 23:19:03 +0000,http://twitter.com/download/iphone,This is Vince. He's a Gregorian Flapjeck. White spot on legs almost looks like another dog (whoa). 9/10 rad as hell https://t.co/aczGAV2dK4,https://twitter.com/dog_rates/status/709519240576036864/photo/1,9.0,Vince,None,cocker_spaniel,247,1542
709449600415961088,,,2016-03-14 18:42:20 +0000,http://twitter.com/download/iphone,Meet Karma. She's just a head. Lost body during the Second Punic War (unfortunate). Loves to travel 10/10 petable af https://t.co/c6af6nYEPo,"https://twitter.com/dog_rates/status/709449600415961088/photo/1,https://twitter.com/dog_rates/status/709449600415961088/photo/1",10.0,Karma,None,Maltese_dog,609,2316
709409458133323776,,,2016-03-14 16:02:49 +0000,http://twitter.com/download/iphone,This is Billy. He sensed a squirrel. 8/10 damn it Billy https://t.co/Yu0K98VZ9A,https://twitter.com/dog_rates/status/709409458133323776/photo/1,8.0,Billy,None,Shetland_sheepdog,723,2711
709225125749587968,,,2016-03-14 03:50:21 +0000,http://twitter.com/download/iphone,This is Walker. He's a Butternut Khalifa. Appears fuzzy af. 11/10 would hug for a ridiculous amount of time https://t.co/k6fEWHSALn,https://twitter.com/dog_rates/status/709225125749587968/photo/1,11.0,Walker,None,Labrador_retriever,601,2497
709207347839836162,,,2016-03-14 02:39:42 +0000,http://twitter.com/download/iphone,This is Penny. She's trying on her prom dress. Stunning af 11/10 https://t.co/qcZDZGCapg,https://twitter.com/dog_rates/status/709207347839836162/photo/1,11.0,Penny,None,Chihuahua,6154,13042
709158332880297985,,,2016-03-13 23:24:56 +0000,http://twitter.com/download/iphone,Meet Rodney. He's a Ukranian Boomchicka. Outside but would like to be inside. Only has one ear (unfortunate) 10/10 https://t.co/FjAj3ggXrR,https://twitter.com/dog_rates/status/709158332880297985/photo/1,10.0,Rodney,None,Siberian_husky,440,2116
708845821941387268,,,2016-03-13 02:43:08 +0000,http://twitter.com/download/iphone,Here's a pupper with magic eyes. Not wearing a seat belt tho (irresponsible af). Very distracting to driver. 9/10 https://t.co/5DLJB4ssvI,"https://twitter.com/dog_rates/status/708845821941387268/photo/1,https://twitter.com/dog_rates/status/708845821941387268/photo/1",9.0,None,pupper,schipperke,945,3095
708834316713893888,,,2016-03-13 01:57:25 +0000,http://twitter.com/download/iphone,Meet Malikai. He was rolling around having fun when he remembered the inevitable heat death of the universe. 10/10 https://t.co/Vd2FqHIIGn,https://twitter.com/dog_rates/status/708834316713893888/photo/1,10.0,Malikai,None,Eskimo_dog,531,1755
708810915978854401,,,2016-03-13 00:24:26 +0000,http://twitter.com/download/iphone,This is Mister. He's a wonderful father to his two pups. Heartwarming af. 10/10 for all https://t.co/2KcuJXL2r4,"https://twitter.com/dog_rates/status/708810915978854401/photo/1,https://twitter.com/dog_rates/status/708810915978854401/photo/1,https://twitter.com/dog_rates/status/708810915978854401/photo/1",10.0,Mister,None,golden_retriever,7308,17082
708738143638450176,,,2016-03-12 19:35:15 +0000,http://twitter.com/download/iphone,This is Coco. She gets to stay on the Bachelor for another week. Super pumped 11/10 https://t.co/wsCB6LFNxD,https://twitter.com/dog_rates/status/708738143638450176/photo/1,11.0,Coco,None,Pomeranian,862,2846
708479650088034305,,,2016-03-12 02:28:06 +0000,http://twitter.com/download/iphone,Meet Bear. He's a Beneboop Cumberclap. Extremely unamused. 13/10 I'm in love with this picture https://t.co/uC8kUqAz0W,https://twitter.com/dog_rates/status/708479650088034305/photo/1,13.0,Bear,None,Shih-Tzu,707,2642
708469915515297792,,,2016-03-12 01:49:25 +0000,http://twitter.com/download/iphone,This is Bobble. He's a Croatian Galifianakis. Hears everything within 400 miles. 11/10 would snug diligently https://t.co/VwDc6PTDzk,https://twitter.com/dog_rates/status/708469915515297792/photo/1,11.0,Bobble,None,Chihuahua,862,3203
708356463048204288,,,2016-03-11 18:18:36 +0000,http://twitter.com/download/iphone,This is Oliver. That is his castle. He protects it with his life. He's also squishy af. 10/10 would squish softly https://t.co/oSuEGw0BhX,"https://twitter.com/dog_rates/status/708356463048204288/photo/1,https://twitter.com/dog_rates/status/708356463048204288/photo/1",10.0,Oliver,None,pug,1398,3735
708149363256774660,,,2016-03-11 04:35:39 +0000,http://twitter.com/download/iphone,This is Jebberson. He's the reigning hide and seek world champion. 10/10 hasn't lost his touch https://t.co/VEFkvWCoHF,https://twitter.com/dog_rates/status/708149363256774660/photo/1,10.0,Jebberson,None,Cardigan,1614,4430
708130923141795840,,,2016-03-11 03:22:23 +0000,http://twitter.com/download/iphone,Please stop sending in non canines like this Guatemalan Twiggle Bunny. We only rate dogs. Only send in dogs... 11/10 https://t.co/XKhobeGuvT,https://twitter.com/dog_rates/status/708130923141795840/photo/1,11.0,None,None,French_bulldog,880,3518
708119489313951744,,,2016-03-11 02:36:57 +0000,http://twitter.com/download/iphone,This is Cooper. He basks in the glory of rebellion. 9/10 probably a preteen https://t.co/kDamUfeIpm,https://twitter.com/dog_rates/status/708119489313951744/photo/1,9.0,Cooper,None,Norwich_terrier,1028,2778
708109389455101952,,,2016-03-11 01:56:49 +0000,http://twitter.com/download/iphone,This is Remington. He was caught off guard by the magical floating cheese. Spooked af. 10/10 deep breaths pup https://t.co/mhPSADiJmZ,https://twitter.com/dog_rates/status/708109389455101952/photo/1,10.0,Remington,None,Staffordshire_bullterrier,568,1999
708026248782585858,,,2016-03-10 20:26:26 +0000,http://twitter.com/download/iphone,Everybody stop what you're doing and watch this video. Frank is stuck in a loop. 13/10 (Vid by @klbmatty) https://t.co/5AJs8TIV1U,https://twitter.com/dog_rates/status/708026248782585858/video/1,13.0,None,None,malinois,2015,4519
707969809498152960,,,2016-03-10 16:42:10 +0000,http://twitter.com/download/iphone,Meet Rufus. He's a Honeysuckle Firefox. Curly af. Badass tie. About to go on his first date ever 11/10 good luck pup https://t.co/dGoTWNfIsm,https://twitter.com/dog_rates/status/707969809498152960/photo/1,11.0,Rufus,None,toy_poodle,1019,2805
707776935007539200,,,2016-03-10 03:55:45 +0000,http://twitter.com/download/iphone,This is Sadie. She's a Bohemian Rhapsody. Remarkably portable. Could sneak on roller coasters with (probably). 11/10 https://t.co/DB8fyeDs8B,https://twitter.com/dog_rates/status/707776935007539200/photo/1,11.0,Sadie,None,miniature_pinscher,996,3405
707741517457260545,,,2016-03-10 01:35:01 +0000,http://twitter.com/download/iphone,When your roommate eats your leftover Chili's but you pretend it's no big deal cuz you fat anyway. 10/10 head up pup https://t.co/0nMgoue8IR,https://twitter.com/dog_rates/status/707741517457260545/photo/1,10.0,None,None,whippet,645,2587
707610948723478529,,,2016-03-09 16:56:11 +0000,http://twitter.com/download/iphone,This is Harper. She scraped her elbow attempting a backflip off a tree. Valiant effort tho. 12/10 https://t.co/oHKJHghrp5,https://twitter.com/dog_rates/status/707610948723478529/photo/1,12.0,Harper,None,golden_retriever,6744,17583
707411934438625280,,,2016-03-09 03:45:22 +0000,http://twitter.com/download/iphone,"""I shall trip the big pupper with leash. Big pupper will never see it coming. I am a genius."" Both 11/10 https://t.co/uQsCJ8pf51",https://twitter.com/dog_rates/status/707411934438625280/photo/1,11.0,None,pupper,Lakeland_terrier,624,2371
707387676719185920,,,2016-03-09 02:08:59 +0000,http://twitter.com/download/iphone,Meet Clarkus. He's a Skinny Eastern Worcestershire. Can tie own shoes (impressive af) 10/10 would put on track team https://t.co/XP5o7zGn0E,https://twitter.com/dog_rates/status/707387676719185920/photo/1,10.0,Clarkus,None,Chihuahua,1363,3632
707377100785885184,,,2016-03-09 01:26:57 +0000,http://twitter.com/download/iphone,This dog just brutally murdered a snowman. Currently toying with its nutritious remains 9/10 would totally still pet https://t.co/iKThgKnW1j,"https://twitter.com/dog_rates/status/707377100785885184/photo/1,https://twitter.com/dog_rates/status/707377100785885184/photo/1",9.0,None,None,golden_retriever,1137,3402
